,id,normalize,posicionamento
1289,"1,18262845565094E+018", eu vivi pra ver a imprensa brasileira ser desmentida pela✔️embaixada americana ✔️secretário de estado mike pompeo…,
1290,"1,18210447942187E+018", erro foi alguém ter colocado esse cara ali,
1291,"1,12744261991372E+018", turco durante uma entrevista carile deu a entender que com a chegada do everaldo poderia utilizar o clayson como meia mencionando suas atuações na ponte preta o que você acha,
1292,"1,06209449921052E+018",adicionei um vídeo a uma playlist amor clipe oficial  isaias sad,
1293,"1,18313102651789E+018",agora to com vontade de sair,
1294,"1,18279773770586E+018", o dodle do gogle de hoje é em homenagem a maria firmina dos reis a primeira mulher negra a publicar um romance em…,
1295,"1,18246693545753E+018", kk,
1296,"1,17484034290823E+018",aquele que luta com monstros deve acautelarse para não tornarse também um monstro quando se olha muito tempo para um abismo o abismo olha de volta para você✓friedrich nietzsche,
1297,"1,18213235222455E+018", ok,
1298,"1,18306340291631E+018", trump evermore😇💖😇k17,
1299,"1,18318762667061E+018", penitenciárias privadas quanto mais presos mais dinheiro para os concessionários quanto pior o tratamento do sistema maior lucro,esquerda
1300,"1,18022315845817E+018", saiu mais de 3 notas esse ano falando que se a yge que se erguer ela precisa focar em blackpink e da o que as meninas mer…,
1301,"1,18703878964824E+018",detalhe o cartaz foi bordado pela pontos de luta grupo de bordadeiras de bh,
1302,"1,16396133730064E+018", a partir da permanência destas pessoas nas universidades é que elas próprias podem formular políticas públicas porque elas…,
1303,"1,18313915662249E+018", ouvi dizer que a esquerda anda espalhando que o presidente foi vaiado no santuário de aparecida ele não foi,direita
1304,"1,18208203450583E+018", oioioi ,
1305,"1,18313096990739E+018", eu respondendo rápido depois de ter sido ignorado 5 horas k ,
1306,"1,18320584793099E+018",esse que vos fala na versão anos 80 o tempo corre ágil as décadas vão dizendo adeus e assim prossegue a maravilhosa jornada por esse mundão de meu pai amém 🙏 ,
1307,"1,18131002275788E+018",amei demais que avenida brasil voltou😍,
1308,"1,18011901515233E+018", ótimo notícia porém o congresso está contaminado e com rabo preso com stf não acredito que está pec vai caminhar e continuaremos com alguns ministros corruptos e defensores de criminosos no controle do país,
1309,"1,09629274373374E+018", se o votar contra a criminalização da homofobia ou algum ministro pedir vistas adiando o processo será a confirmacao da homofobia,esquerda
1310,"1,16412643125066E+018", leve umas carteiras de trabalho não fica um na frente,
1311,"1,1831428564474E+018",terminou ,
1312,"1,1030010208824E+018", kk,
1313,"1,18319205642193E+018", vídeo – bolsonaro é vaiado em aparecida ,
1314,"1,18315330508782E+018", quem te crítica nao conhece a fome o desemprego a falta de ter algo sempre será lembrado ❤,
1315,"1,18308050885245E+018",carlinemonafestajuninajpg ,
1316,"1,13772205485639E+018", 🚨101 wek giveaway🚨here’s your chance to bost your bankrol before 101 wek we’re giving away €20 to 5 random fol…,
1317,"1,18311560253955E+018",não sei pq eu insisto ainda,
1318,"1,09539749162797E+018", cultura de universitário é ver sua saga de livros inteira por 75 conto e não ter 10 nem pro salgado caro da facul,
1319,"1,17257012044462E+018", um órgão de imprensa inglês publica com toda fidelidade o que estou pensando peço a todos e todas que compartilhem ao máx…,
1320,"1,18273843429057E+018",o min da infraestrutura negocia r 4 bilhões extra para obras públicasna alesp propus um pl que obriga o estado a contratar um seguro anticorrupção para toda obra pública e objetiva que toda obra tenha o valor a qualidade e o prazo estimado na licitação ,
1321,"1,18245441967953E+018", eu depois de beijar a boquinha que eu sempre quis ,
1322,"1,17592864458747E+018",a favela fala que quem atirou foi a polícia se fosse os traficantes eles estavam gritando por justiça em plena comunidade todo mundo sabe que eles atiram pra botar a culpa na polícia fala isso globo fantastico,direita
1323,"1,17983324244013E+018", parece que o povo vive constantemente em surto psicótico,
1324,"1,18275123869538E+018", índice abcr de setembro aponta alta de 32 no fluxo de rodovias concedidas corredores importantes na comparação com m…,
1325,"1,18319123943854E+018",brasil um país de partido sem partidários,
1326,"1,08915661467698E+018", fernando pimentel do pt é o culpado rameira maldita,direita
1327,"3,46782236881867E+017",me distrai com as notícias das invasões  quando fui ver o tom capotado no meio das almofadas… ,
1328,"1,18210541873207E+018", 🙍🏻‍♀️,
1329,"1,18163851626407E+018", não me conformo que não tem uma pessoa pra corrigir o que eles escrevem sabe são 5 frases a noção eu já não espero dessa família faz tempo,
1330,"9,01273474584514E+017",lembrete do dia respeito regime e empatia devem ser praticados escolha ao menos um e pratique,
1331,"1,18241287730879E+018", pracegover12cássio23fagner26gil 4manoel35danilo avelar15ralf28ramiro2mateus vital9vagner love c25…,
1332,"1,18132460551401E+018", serve 1 compra yjcxqunlz8,
1333,"1,18320227038681E+018", flamego é uma devoção ninguém pode explicar o amor maior do que a razão é muita tradição pra sempre vou te amar ❤ ,
1334,"1,17015904677265E+018", um presidente que celebra ditaduras um ministro dá entrevista a supremacista branco outro repete presidente e insulta primeira dama fora bolsonaro,direita
1335,"1,18589225678554E+018",bom dia já assistiu a conversa com a dilma vale boas risadas nesse domingo 😃 com gustavo mendes ,
1336,"1,18319813588519E+018",“i’m the majority” discurso memorável do civil estadunidense via iamthemajority,
1337,"1,18194364633105E+018",se preparem pro português dos integrantes derretendo de amor,
1338,"1,18281122574866E+018", e gardevoirs machos representam mulheres trans ,
1339,"1,18229351605728E+018", partidos são essenciais para a democracia e suas empresinhas com o que contribuem😡,
1340,"1,17615247364552E+018",desenhando a explicação  que é militância ,
1341,"1,178062067603E+018", regra nova vai a merda seu mau caráter sem vergonha,
1342,"1,16177279668451E+018", boa noite seguindo todos,
1343,"1,18197226732197E+018",ô desespero impeachmentdobolsonarourgente,
1344,"1,18120937312693E+018", roberto carlos ver progresso no governo  só a mídia canhota e a oposição não ver vamos nos unir,direita
1345,"1,15163556808382E+018",decisão de tofoli de suspender uso de dados do coaf atinge investigações contra facção criminosa diz chefe do mp de sp  são paulo  g1 ,
1346,"1,18291182203644E+018", chupa ovo do bolsonaro robô do bolsonaro ou caixa 2 do bolsonaro,esquerda
1347,"1,18238663537739E+018", kk,
1348,"1,18193684572003E+018",bobocas palpiteiros ,
1349,"1,18276601239724E+018", obrigado ,
1350,"1,1831669513482E+018", quem diria maduro e maria gabriela chaves filha de hugo chaves tem conta no banco do vaticano alguma surpresa com o comunismo,direita
1351,"1,18298990270892E+018", ideologia é o meu pau calçado todinho em em 😍,
1352,"1,16544073585391E+018",me pueden seguir en instagram como cpuentespre ,
1353,"1,17232196545917E+018",merval pereira vc sonha com bolsonaro né globolixoj10,direita
1354,"1,09001467491612E+018", fodase rameira,
1355,"7,13813575513543E+017",ao vivo no periscope banda memory ao vivo ,
1356,"1,18319112336117E+018", cpacbrasil não bata no cnpj globolixo bata no cpf dos oligarcas familiamarinholixoquebrar os monopólios pra quebrar…,
1357,"1,10074149566414E+018",tenho 1270 pontos no blablablametro transforme sua influência social e o uso do seu timbeta em benefícios ,
1358,"1,18205686477269E+018", ha ksksks,
1359,"1,16886656944907E+018", em pleno 2019 enquanto está cheio de brancos de terno roubando todos os dias nosso dinheiro e nossa dignidade não se trata de partido a ou b mas do sistema brasil de política,
1360,"1,18310162354921E+018",eu amo esse vídeo da cardi b k ,
1361,"1,18131200261192E+018",3em1 o que será que o vaticano quer  será que tem ouro na amazônia,
1362,"1,15277647020652E+018", parabéns meu herói,
1363,"1,08887570136791E+018", as nossas tragédias se repetem as famílias de brumadinho enfrentando o mesmo sofrimento que as de mariana há 3 anos o…,
1364,"1,18269748943201E+018",mulher que não ilude nasce em que mês 🤷🏽‍♂️,
1365,"1,1815712916541E+018",deu certo no dia que eu nasci tô correndo na frente essa coisa de to correndo atrás não têm futuro corra na frente sempre em são paulo ,
1366,"1,1823944885028E+018", eu torco com energia para que tudo dê errado nesse governo cada derrota é uma vítória ♥,
1367,"1,18314058623003E+018", o presidente jair bolsonaro recebeu no palácio do planalto esther castilho de 9 anos com a sua mensagem para o dia das criancas,
1368,"1,18276891359313E+018", o texto do que resultou no cancelamento de uma prova em um colégio em bhquanto da sua tristeza você consegu…,
1369,"1,18319376284935E+018", e pior caso as pessoas não aceitem todas as características pré definidas da caixinha que ela pertence elas são traidoras e merecem ser excomungadas e eliminadaso negócio está tenso agora eu estou começando a entender porque existem pessoas 10 pessimistas,
1370,"1,1831770389219E+018", feliz dia pra você que não é criança mas chora como uma quando perde o brinquedo que não cuidou,
1371,"1,12830576580092E+018", a daenerys governando pras 3 pessoas que ela deixou viva em kings landing gameofthrones ,
1372,"1,1827118548267E+018",4 bandidos armados invadindo a casa do cidadão de bem vocês acham que eles respeitam a lei só entendem uma linguagem tiro ,direita
1373,"1,18305374225136E+018",quer usar o lombo do bolsonaro para se firmar como futuro candidato a presidência ,direita
1374,"1,17699306008293E+018", finalmente ,
1375,"1,18225311381579E+018", olga tokarczuk e peter handke ganham o nobel de literatura ,
1376,"1,18302707019411E+018", k ,
1377,"1,1827511548806E+018", coluna ou jogo,
1378,"1,17155735726187E+018",bem esse filho do presidente que foi visitalo com certeza é o que policial e se não for certamente possui porte e posse de arma ,
1379,"1,17958012052644E+018",o tempo ,
1380,"7,38092970956706E+017", authentic vc gosta de comer sem trabalhar,direita
1381,"1,18242112877983E+018",ministro da justiça sérgio moro participa de jantar com parlamentares do psl ,
1382,"1,13370356864776E+018", eu tenho um paciente com deficiência intelectual que gosta muito de você ele resolveu te fazer essa homenagem espero que você goste 😬 ,
1383,"1,18315540944148E+018", taxa de homicídio por 100 habitantes🇧🇷brasil1980 122018 30🇺🇸eua1980 1022018 5o brasil restringiu…,
1384,"1,17523845779236E+018", seu avô que passou a vida inteira trabalhando duro ainda tendo tempo pra educar os filhos é frouxo por não ter largado…,
1385,"1,02372195194736E+018",encrenca,
1386,"1,17121633948006E+018", mostarda ketchup maionese ,
1387,"1,18786118759944E+018", essa é a visão socialista contada nas faculdades de ciências humanas repito tanto capitalismo como socialismo implicam em dominação manipulação e subjugo de massas,neutro
1388,"1,18787790567162E+018", estamos preocupados com possíveis retrocessos no combate à corrupção no brasil diz dirigente da ocde ele se refere às…,neutro
1389,"1,18787469805247E+018", “o stf tem que seguir a letra da constituição”exceto se for para inventar “crime de homofobia” legalizar clínica de aborto,direita
1390,"1,18757431566497E+018",hoje e dia de ser patriota bolsomito 😎👉😎🇧🇷🇧🇷🇧🇷🇧🇷,direita
1391,"1,18740110305233E+018", mas eles podem argumentarhurdur bolsomito ja avisou bem antes que é só pra acreditar nas notícias que ele posta no twiter pq os jornalistas postam tudo fake news hurdurr,direita
1392,"1,1878748534934E+018",livrainos do neo liberalismo urgente lulalivre resiste,esquerda
1393,"1,18786918955142E+018",quer me ensinar feminismo mas não fazia ideia que anti concepcional fazia mal 2 segundos atrás entendi,esquerda
1394,"1,18787684773396E+018",todo liberal é mongol a ponto de crer que todo mundo deve pensar de forma neutra,esquerda
1395,"1,18738653096231E+018", na verdade a skynet rede de perfis falsos e fake news do bolsolixo,esquerda
1396,"1,18787732024324E+018", responsabilidade e comprometimento com o interesse público foi o que deltan mais uma vez demonstrou ao optar por ficar na …,direita
1397,"1,18787261363431E+018",por que só as mulheres tem sabonete íntimo que regula ph o ph do pênis também merece regulaçãochega de diferenças feminismo ninguemdesregulaophdeninhuem,direita
1398,"1,1878663992193E+018",olhando máquina de expresso no mercado livre,neutro
1399,"1,18787314757349E+018", isso é uma das coisas mais deprimentes que a lavajato trouxe disputar o processo penal na pesquisa de opinião a busca…,neutro
1400,"1,18787790237484E+018", de olho no mercado centroavante que já esteve nos planos do inter deve ficar livre no mercado na próxima temporada ht…,neutro
1401,"1,18786828553626E+018", com todo respeito a sua opinião vc acha que o socialismo ou comunismo são a solução mas não em ambos o pobre não sobe ao nível do rico o rico é que desce a categoria do pobre empurrado pelo punho pesado do estado e de onde vc acha que vem o dinheiro de cima pra baixo,direita
1402,"1,18787691527476E+018", por que a midia brasileira passa por alto o levante chileno porque o chile havia sido eleito para ser vitrine do novo mundo neoliberal,esquerda
1403,"1,18787618867031E+018", é incoerente afirmar que brancos sofrem racismo enquanto os mesmos estão em toda a sociedade exercendo cargos de privilégios eles não são mortos pelo estado que é branco eles não são seguidos nas lojas não são ridicularizados e isso tudo apenas pela cor de sua pele,esquerda
1404,"1,18787301551995E+018", no mercado livre e você,neutro
1405,"1,1878773157805E+018", ela é claramente racista não é a primeira nem a última vez que isso irá acontecer não adianta vir aqui nesse twiter pa…,esquerda
1406,"1,18787795045415E+018",o melhor é ver quem acreditava no liberalismo perfeito do paulo guedes vendo a situação do chile amei a derrota só pra mostrar que essa política de capitalização não da ceo,esquerda
1407,"1,18743681658196E+018", bolsomito não mente,direita
1408,"1,18787696803077E+018", agora que eu vi a isentolandia furiosa com quem tá pedindo pra não quebrar nada agora e esperar até novembro dá pra ter certeza,neutro
1409,"1,18787401548396E+018", definição de liberalismo tá certo n achamas dizer que fhc era liberal só pq privatizou uma 2 estatais é de cair o cu da bunda o cara mesmo já admitiu que é marxista convicto,direita
1410,"1,18787791377081E+018",engraçado eu não vi o bolsonaro falar de expulsar comunista na china ele foi pedir mercado 🧐,esquerda
1411,"1,18782697855823E+018",então bolsomito vinha de mitomaníaco 🤔 ,esquerda
1412,"1,18787323611105E+018",quando os meninos aceitam o socialismo uma vez na vida ,esquerda
1413,"1,18787658032602E+018", aos eleitores do bolsonaro fica aqui minha pergunta bolsonaro odeia socialistas e comunistas a china é governada por um socialista,esquerda
1414,"1,18744114072488E+018", mais um gol de placa do bolsomito mais turismo mais riqueza enquanto os velhos governos se preocuparam em roubar  mito se preocupa com desenvolvimento,direita
1415,"1,18739792051927E+018", depois da coptação do vaporwave eu não duvido de mais nenhum tipo de coptação estética da direitajá imagino uns vegeta bolsomito se a moda pegar,neutro
1416,"1,18787723222577E+018", notem que o stf se esquece completamente da tal fidelidade constitucional quando legisla sobre a homofobia quando mete o bedelho,direita
1417,"1,18787483934173E+018",desculpa de coração feminismo mas essa menina eu não suporto mais,neutro
1418,"1,1878775129086E+018", porra haja sardola são autoritários tb vc vai ver isso quando o povo perceber a merda que fez e for protestar ele chega a babar em transformar quem reclama em comunista e mandar sentar a porrada,esquerda
1419,"1,18787055993119E+018",certas coisas eu prefiro nem comentar eu deixo que a vida ensina que todas nós mulheres precisamos do feminismo e fico tranquila porque sei que ensina,esquerda
1420,"1,18787086556593E+018",tem mina que infelizmente eu preciso dar folga ao meu feminismo pra lidar pq sinceramente não aguento render tanto pra namorado dos outros,neutro
1421,"1,18787498729581E+018",acabei de dar uma aula via whatsap pro meu namorado sobre feminismo radical,esquerda
1422,"1,18787728419743E+018",hey olhano presidente de vocês apertando a mão de comunista,esquerda
1423,"1,18787746859573E+018", eu não vou passar pano para o ramon e nem tentem defender esse escroto envolvendo algo com racismo porque se vocês tivessem…,neutro
1424,"1,18787214907329E+018",menina que se diz feminista mas se atira pros caras com namoradas ou da trela pra cara que namora qual o sentido do teu feminismo,neutro
1425,"1,18787143898593E+018", essa turminha de desocupados esquerdistas deveriam desenterrar a confederação do equador assim fundaram um país socialista só para eles mas eles têm que morar lá e não fazer propaganda do socialismo vivendo em país capitalista como os demais fazem,direita
1426,"1,18787612075202E+018", se o stf extinguir a execução da pena em 2ª instância os acusados de crime de homofobia sem lei só poderão ser considerados ,direita
1427,"1,18786388118994E+018",as nossas tribos nunca serão muito grandes por isso o socialismo não funciona há muito pouco que poderemos dizer que uma tribo de 10 milhões de pessoas tem em comum nem uma reunião de condomínio consegue ser uma tribo pacífica e sem diferenças,direita
1428,"1,18787490409346E+018",nao ao neo liberalismo lulalivreresiste lula livre resiste,esquerda
1429,"1,18787754014636E+018", da pra entender que a régua moral de alguns condenam mais um candidato que fala mrda no superpop e cqc do que um posterior preso,direita
1430,"1,18787775293185E+018", gilmar calado seu energúmeno desalmado sanguinário adúltero do próprio ser não em você não existe um ser é apenas uma massa de corrupção mentiras e enganos te cercam você vê a suas maldades doce mais no fim vai ser amargo,neutro
1431,"1,18719677218524E+018", parece que apareceu irmão perdido dela e que o cara é bolsomito 😎👉,direita
1432,"1,18787411540487E+018",isso vai acontecer com o jovem conservadorliberal daqui uns 30 anos tb fora liberalismo,esquerda
1433,"1,18787490871977E+018", oi mo eu li o texto e vc colocou que la homofobia nao eh crime mas eh crime sim desde junho,esquerda
1434,"1,18787779477424E+018",meu pai hoje me fez ter uma crise de ansiedade me obrigou a entrar na casa dele e conversar eu dopada nossa foi um show de homofobia misoginia e preconceito com meus problemas de saúde,esquerda
1435,"1,18787717900419E+018", todas as opções mas a maior é o racismo estrutural ,esquerda
1436,"1,18785468589557E+018", para que possamos te ajudar por favor nos informe seu nome de usuário pode vêlo clicando aqui  quando nos enviar essa informação uma equipe especializada entrará em contato em seu email registrado no mercado livre em até 48h,neutro
1437,"1,18787665872601E+018", olha na minha humilde opinião uma pessoa branca nunca vai sofrer algo pela sua cor da pele como uma pessoa negra ou amarela entao nao branco nao sofre racismo,esquerda
1438,"1,18787633659508E+018",picasso era um pintor muito envolvido cm a política de seu tempo em 194 filiouse ao partido comunista francês e esse período marcou sua pintura em 1945 já filiado ao partido comunista picasso empenhouse em denunciar a violência das guerras capitalistas memoriahistorica,neutro
1439,"1,18787557518205E+018",veja lula assassino🦌 bolsominios verdade veja melhor revistaveja flávio bolsonaro comanda laranjas em esquema de corrupção🦌 bolsominios revista comunista esquerdopata vejalixolulamandantedocrime,neutro
1440,"1,18787463269677E+018", impressionante a capacidade de convencimento da lavajato para delatores que são criminosos confessos tentando a…,neutro
1441,"1,18787724371393E+018", a branca que provavelmente namora branco falando sobre racismo pra ficar famosa e poder ter mais atenção de gente branca voce é a senhorita morelo do seculo 21,neutro
1442,"1,18777386255087E+018",o oleo no nordeste é terrorismo e o grenpeace só nos atrapalha  bolsomito jair,direita
1443,"1,18787543499581E+018", ja pode da voadora em comunista,direita
1444,"1,18787648597101E+018",⚠️chamem as manas do desenhofeminismo feminista desenho designer anápolis anapolis goiás goias ifg ufg ueg sexualidade lgbtq trans lesbica lésbica artesvisuais ,esquerda
1445,"1,18786753378696E+018", na america do sul existe o capitalismo de compadre dos amigos dos reis ni brasil 5 bancos e 7 empreiteiras dominam no chile a mesma merda e a solução é o socialismo não acredito nisso acredito na economia dos países ricos liberais na cultura do dinheiro e do estado minimo,direita
1446,"1,18787756433916E+018", o socialismo é podre e organizado o foro de são paulo esta por traz de tudo que esta acontecendo na américa do sul,direita
1447,"1,18787380841117E+018",ao vivo um milhão de chilenos em festa marcham no funeral do liberalismo ,esquerda
1448,"1,18772916239772E+018",finalmente posso libertar minha paixao pelo bolsonaro bolsonaroorgulhaobrasil bolsomito bolsonaroestamoscontigo,direita
1449,"1,18787777833677E+018",podcast é apresentado pela jornalista esportiva de o liberal andreia espírito santo e tem a participação da jornalista mayara almeida ,neutro
1450,"1,1878734663531E+018",e esse é o sistema previdenciário de capitalização do chile neoliberal que o paulo guedes tanto ama ,esquerda
1451,"1,18787464365649E+018", eu digo que é homofobia e o argumento deles vai cair por terra,direita
1452,"1,18787755423922E+018",quer dizer então que 9 senhor está fazendo acordo comercial com comunista,esquerda
1453,"1,18787534509097E+018",🎙no meio do ‘roubo’ da petrobras tinha uma lavajato tinha uma lavajato no meio do ‘roubo’ da petrobrasbandidobomēbandido¿lucro da petrobras petr4 sobe 37 e chega a r 908 bilhões no 3º trimestre ,direita
1454,"1,18787557796706E+018", meu deus que horror isso é o paraíso liberal,esquerda
1455,"1,18787735711112E+018", istoé o moro trabalhando contra corrupção do psdb e da família bolsonaro k ,neutro
1456,"1,18721070694654E+018", coloca aí  flamengo campeão brasileiro libertadores e mundial  graças ao bolsomito que mostrou que a austeridade financeira dá resultado a longo prazo,neutro
1457,"1,18785170568324E+018",fundamentalistas do mercado veneram o livre mercado mas ninguém quer comprar os livros deles ,esquerda
1458,"1,18787461904017E+018", esquerda nao gostou do que ele disse aposto pois alegavam homofobia,direita
1459,"1,1878765386682E+018", mais irônico é você que sempre foi preto e sentiu na pele o racismo ou seja sempre viu a repulsa da galera nessa questão…,neutro
1460,"1,18787453438655E+018", pois então repressão disfarçado de liberal,esquerda
1461,"1,18787794902397E+018", vamos falar de racismo religioso e racismo dar os conceitos certos pro que estamos discutindo e vamos desenhar pros brancos…,neutro
1462,"1,18786620669235E+018",vem com gosto socialismo ,esquerda
1463,"1,18787484546123E+018", deixa de falar besteira sua chatao cara está progredindo com o trump o país está em crescimento aceita que dói menos sua comunista,direita
1464,"1,18787450125566E+018", por que vocês gosta de atacar o que realmente gera dinheiro e o que realmente as coisas certas porque que vocês atacam tanto o capitalismo sendo que o capitalismo que gera dinheiro e o socialismo gera miséria,direita
1465,"1,1878562373812E+018",o relatório doingbusiness do banco mundial aponta que nosso país é extremamente burocrático nosso problema não é o livre mercado é o excesso de intervenção ,direita
1466,"1,18787714310935E+018",minha amg poc dioga sofreu racismo e homofobia hoje vao se fuder seus racistinha e homofobico de merda b noite 💜,esquerda
1467,"1,18746372089036E+018", bolsomito virou coach motivacional ,direita
1468,"1,18787739018745E+018", se é fato que existia e existe corrupção no brasil é fato hoje comprovado que as investigações o mp e judiciário,neutro
1469,"1,18787613272668E+018", em evento ativista estadunidense destaca legado de mariele é combustível à resistência popular cita o trabalho de…,neutro
1470,"1,1878736701376E+018",então é hora do escrever mais um texto informando pra eles o quanto estão errados já que lá é um exemplo de liberalismo pro nosso brasilzão véio ,esquerda
1471,"1,18787459730111E+018", isso vai acontecer com o jovem conservadorliberal daqui uns 30 anos tb ,esquerda
1472,"1,18787551626889E+018", pornografia aonde fi  é so um marshi não sei oque saindo do cu homofobia e crime ne k,neutro
1473,"1,18787514423408E+018", ooh pessoal tão me pedindo aí pra comentar aítragadanão é hora di manifestação nenhuma poπavocês não vêem…,neutro
1474,"1,18787750863455E+018",bolsonaro fala tanto mal de comunista pq tá babando o ovo dos chineses é um ridículo mesmo,esquerda
1475,"1,18787422958229E+018",🌈 •• atrás homofóbicos ¡por atrás ,neutro
1476,"1,18773532208547E+018", bolsomito 202,direita
1477,"1,18787669213778E+018", e aos defensores da desregulação do mercado do livre comércio sem nenhuma barreiraessa é a ética do mercado,direita
