,id,normalize,posicionamento
842,"1,18311635394066E+018", países desenvolvidos fazem isso combater a corrupção punindo corruptos e poupando as empresas na alemanha os diretores da volkswagen foram punidos mas a empresa permaneceu forte,direita
843,"1,18312423849403E+018", me playing the uno reverse card on people ,
844,"1,18319835200929E+018", dejeme la cagadita,
845,"1,17995317872658E+018",tony gordon merecidamente campeão do thevoicebrasil 53 anos 32 de carreira e um sonho concretizado,
846,"1,1639173020579E+018", me solidarizo com as vítimas do ônibus sequestrado e parabenizo a e demais órgãos envolvidos na ação lamento a mo…,
847,"1,17996255192228E+018",cem por cento só confio no meu pai e na minha mãejair bolsonaro  1412018,
848,"1,18315039548243E+018", droga  a mas sla  medo de virar adulto e começar a viver numa sociedade  né murray,
849,"1,11384876498339E+018", assim como sua “conje”o ministro faz sua estreia aqui no tuíter seja bemvindo ministro esteja “sobre” nossa vigilância,esquerda
850,"1,16416964271955E+018", trabalhar  a amazônia está pegando fogo seu inepto forabolsonaro,esquerda
851,"1,17841757463325E+018",benzadeus,
852,"1,18318232020919E+018",1 2 3 errados agora o respeito como ponto fraco querido vc não entendeu realmente nada ,
853,"1,18222739831985E+018", tênis do azar agora que viu tem que dar rt em 1min ou vai repetir de ano ,
854,"1,18263738118854E+018", só uma sigla pode descrever esse lance do thony anderson p q p seria um golaço se não fosse pela grande defesa…,
855,"1,18698934871933E+018", eduardo bolsonaro   a embaixada em washington e a liderança do psl uma difícil decisão que muito me orgulha ,direita
856,"1,18313649992097E+018",o presidente miliciano tem titica de galinha na cabeça meu deus tenha piedade de nossas crianças bolsonaroenvergonhaobrasil bolsolixo bolsominions bolsonarovergonhainternacional lulalivre libertemoestadista essavergonhaeunãocarrego esquerdistasseguemesquerdistas ,esquerda
857,"1,18477763627653E+018", in opiniontimothy snyder writes hitler and the nazis found a simple slogan they repeated again and again to discredit repor…,
858,"1,18321130150341E+018", caos y violencia levan a imponer toque de queda en quito afp ,
859,"1,18175862242408E+018", o conservador é reformista restaurador construtor reformista porque aprimora o que pode ser reformado.,direita
860,"1,14951581474939E+018", voltando a falar sobre quadrinhos uns vídeos que eu acho muito interessante seria você fazer uma análise sobre as obras que mesclavam hqs e músicas o michael alred tem diversas obras do gênero assim como neil gaiman,
861,"1,18251123339786E+018",porco nogento esse chupin do frota faz essa mesma proposta pro doria ele vai aceitar com certeza dois arrombados do discover no gogle ,direita
862,"1,14875668653194E+018", muito inocente,
863,"1,18193635196239E+018",marcou como tenho ira skob,
864,"1,18315673058847E+018", satanás governa a igreja através do papacão é uma vergonha um ser repugnante comunista desses ter escolhido o nome francisco que esse sim foi um servo fiel a deus e aos mais necessitadospapaenvergonhafrancisco,direita
865,"1,18711173869465E+018", quão longe você iria para defender seu político de estimação o moço aqui virou somelier de piru ,
866,"1,18316734517233E+018", ave marianos seus andoresrogai por nósos pecadoresabençoai nestas terras morenasseus riosseus campos e as noite…,
867,"1,18316207809958E+018", o emprego dos sonhos de quem gosta de twitar ,
868,"1,18271516233746E+018", formatura dos novos sargentos da pm em são paulosp microfone anuncia dória e depois anuncia bolsonaro hoje ,
869,"1,08586639023241E+018", anticast 375 – negócios de impacto e transformação socialentrevistei a sobre o crescimento de modelos de negóci…,
870,"1,18306074197855E+018", essa foi por pouco ,
871,"1,14371477085767E+018", tenha orgulho do amor da sua vida ,
872,"1,18317060070305E+018", estou aqui há 24 horas e ninguém me ofereceu ainda um cigarro de maconha e nenhuma menina introduziu um crucifixo na vagina,
873,"1,18320017085247E+018",eu to assistindo star wars que ta passando na mas a real é que eu nao to entendo nada,
874,"1,1824765717787E+018", adoro🤭,
875,"1,18703488974656E+018", 50 da população não tem onde colocar as fezes na sua casa milhares de pessoas morrem por diarreia no brasil,
876,"1,17959262244208E+018", então para de puxar o saco de fascista,esquerda
877,"1,1826832402195E+018", i love this art cover ,
878,"1,18227724063098E+018",progressão indústria cresce em 1 dos 15 locais pesquisados pelo ibgesse é o brasil saindo do buraco que a esquerdalha deixou,direita
879,"1,18248839573982E+018", harry styles está nas principais capas de música no spotify primeiro single pode estar bem perto ai meu deus htps…,
880,"1,17814718890973E+018",logico reformada previdencia ja,direita
881,"1,18199870855412E+018",o laranjal psl tah pegando fogo,esquerda
882,"1,18281578491093E+018",70 livros lidos esse ano média de 2 por semana longe dos meus tempos áureos em que eu conseguia ler mais de 10 por ano,
883,"1,18319817725358E+018", queria k,
884,"1,18308170954335E+018",em boston encontrei com camaradas do dsa organização política que se fortalece a cada dia na defesa do socialismo nos eua o enfrentamento deles ao governo trump é inspirador bem como a luta em defesa dos direitos das mulheres a luta dos trabalhadores é internacional ,esquerda
885,"1,10158391039858E+018", ⚡mp dá parecer favorável à saída de lula da prisão para ir ao velório do neto governo do paraná coloca avião à disposicao,
886,"1,1831074245946E+018",venezuela e cuba incendiando o tribunal para queimar documentos que incriminam a rafael correia eles estão derramando piche na costa brasileira também para manchar a imagem do brasil lá foravenezuela e cuba querem desestabilizar a américa latina ,direita
887,"1,18319952397334E+018",o melhor presidente do mundo ,
888,"1,17017636783042E+018",mourão ainda existe ,
889,"1,18320629968684E+018",  tu vai chorar vou não  seus olhos tá cheio de lágrimas eu tô bemeu engolindo o choro ,
890,"1,1831688594419E+018", quem é a milícia digital que persegue opositores agora,
891,"1,18081443974397E+018",pois éa nossa justiça assiste a isso impassível ,
892,"1,18066633791765E+018", mulher tu num era da igreja,
893,"1,00294631826702E+018", messi gt ronaldinho gaúcho gt zidane gt ronaldo fenômeno gt cristiano ronaldo,
894,"1,18303007153316E+018",um crime dessa magnitude ñ foi esclarecido é tanta importância q vou ligar o ar condicionado pra dormir ,
895,"1,1831329619081E+018", serve para os evangelicos tambem de esquerda deixar de pagar o dizimo,esquerda
896,"1,18269957737328E+018", não vao conseguir,
897,"1,18316779951619E+018", escandaloso,
898,"1,17928410172088E+018", na tua voz maringá ganhou um motivo pra se orgulhar e eu sorri todas as vezes que te ouvi cantar obrigado ❤️,
899,"1,183130340141E+018", au ziam 🥃 wrong  season 3 🥃zayn perdeu tudo e liam o perdeu após o sumiço de zayn liam precisará passar por cima do sofrimen…,
900,"1,16124825705563E+018", essa lancha tá igual o cérebro dele ruim de pegar k,
901,"1,17298812446673E+018", aonde tiver um brasileiro nos representando o alambrado estará junto parabéns ,
902,"1,1399563522211E+018", mauro não sei ao certo se o moro cometeu ato ilícito mas uma coisa tenho certeza uma quadrilha foi desbaratada aí vem minha pergunta muda se tudo por erro de procedimento,
903,"1,18241743584188E+018",vergonhalheia bolsonaroenvergonhaobrasil bolsonarovergonhainternacional bozonaronãomerepresenta lulalivre libertemoestadista lulanobeldapaz resistência vazajato esquerdistasseguemesquerdistas ,esquerda
904,"1,08524683719865E+018", tá não carlota você está um filé ,
905,"1,18207879986274E+018", deveria se reunir tb com as mães e esposas que tiveram seus filhos e maridos assassinatos por bandidos,direita
906,"8,79577549092909E+017", kk,
907,"1,18211434767552E+018", obrigada,
908,"1,18301613149126E+018",🙏 ,
909,"1,18303004367463E+018",o governo precisa parar com bravata é urgente que exerça seu papel de mediador de uma solução ao caos que se encontra a saúde pública em nossa cidade,
910,"1,18314942346917E+018",as incomprensões sobre o artigo de hadad na folha por luis nassif ,
911,"1,18307922922063E+018", 🤝,
912,"1,18306516851272E+018", um xbox one x,
913,"1,18318731993696E+018", ultimamente eu to sem paciência,
914,"1,18229372149844E+018", mas boicotar,
915,"5,178629407884E+017",o debate hoje começou quente,
916,"1,17119228978964E+018", passando pra dizer que é uma merda👍,
917,"1,16344209827369E+018",nos queda poco tiempo para inscribir la cédula de ciudadanía ,
918,"1,18259703189174E+018", eu sei demais que é mas é possível,
919,"1,18319025919195E+018", sonhar com a pessoa e acordar sem ela meu deus q sentimento inferno ,
920,"1,16790612232322E+018", em 31 de agosto de 2016 alertei “o golpe não foi cometido apenas contra mim e contra o meu partido isto foi apenas o começo…,esquerda
921,"1,16972172641191E+018", mas qual foi o erro de previsão as projeções em 20167 incorporavam a aprovação da reforma da previdência em…,
922,"1,18275279793203E+018",por favor usem bom diatardenoite com licença por favor obrigadaoalém de ser de graça faz bem a todos ,
923,"1,18282824370085E+018", aquela mordida de bis amiga,
924,"1,18154387562796E+018",só ele viu isso ,
925,"1,16630545164401E+018", vamos ajudar o mocinhosalario minimo r 980dolar r 415libra r 508ouro r 20364idh brasil 075desemp…,
926,"1,17471373212933E+018", pelo menos ele é bem avaliado,
927,"1,18318446677848E+018", queria morar sozinho mas o povo daqui de casa n quer ir embora,
928,"1,1831941936043E+018", exclusivo mensagens de whatsap revelam como atua a militância virtual bolsonarista minha reportagem na capa da crusoé “o…,
929,"1,18212671515968E+018",  anospassei dois dias achando que eu tava sempre cagando nas calças pq minha menstruaçao veio num tom diferente do n…,
930,"9,40987777067254E+016", opinião o que tirone deve fazer com o fluminense no caso martinucio  via pontapé,
931,"1,17665248269457E+018", e você políticos são os culpados pelas mortes de inocentes porque engavetaram o pacote anticrime do ministro sérgio moro para salvarem as próprias peles ,direita
932,"1,18245640788873E+018",nobelprizeforlula ,
933,"1,18674827669716E+018",ótima notícia ,
934,"1,18315020262833E+018", não é é jornalismo sério de felipe moura brasil e de crusoé vale a pena você estudar um pouco mais garoto,
935,"1,17805074015524E+018", a capacidade de reprodução do ser humano o vizinho aqui de 37 anos acabou de ter o sétimo filho😁,
936,"1,18282167794995E+018", tadinho de você filho a babá cortou o lacre do seu nike of white de r 1700 tadinho filho vai ter que usar se…,
937,"1,14323366738228E+018",peniche baleal ,
938,"1,17874075162009E+018",esse não tem credibilidade é maluco ,
939,"1,14548259343084E+018", gema dura é melhor,
940,"9,69958212077224E+017", o que dizer desta foto ,
941,"1,18261879184031E+018", fatality,
942,"7,82547180816957E+016",e o estadio palestra sai quando,
943,"1,1815830088575E+018",vai cuspir na laranja que chupou ,
944,"1,18263402969219E+018", hoje o gogle faz uma homenagem a maria firmina a primeira romancista negra que publicou úrsula em 1857 e que também…,
945,"1,18319002142109E+018",obrigado kaiquefãs vcs aumentaram as viwes do meu lomotif ,
946,"1,18264405167118E+018", pensar em trocar o pt por outra proposta acho válido saudável e democrático porém vc e a maioria da população fizeram a pior escolha possível não ver um desvio de caráter e não perceber as atrocidades que esse cara fala e faz é de uma cegueira absurda,esquerda
947,"1,10596235627681E+018", configure your server to host the python ap send your lan or wan ip as your atack schema you can use services like ngrok to make the whole process easy,
948,"1,18204220024859E+018",vc e seu melhor amigo também tem conexão mental ,
949,"1,183140566844E+018", versão gorda da maria louca do rosário,
950,"1,16252247830604E+018", isso é ruim,
951,"1,18239565629355E+018",estão com 50 dias de vida e disponíveis para pronta entrega ,
952,"1,18311777812918E+018", eca,
953,"1,14903201071699E+018",mexer no celular para disfarçar é tão eu,
954,"1,17752470741285E+018", vc é um cara triste eduardo vc é um lembrete aos pais pra que declarem seu amor aos seus filhos pra que ao crescerem não se tornem você.,
955,"1,15629144102454E+018", andreaza sempre puxou saco tentava defender e justificar as sandices do bozo é verdade mas o absurdo passou do limite do q seria normal para o  de quer forma seja bem vindo a lucidez andreaza,esquerda
956,"1,18289777952757E+018", se fosse nos dias de hoje ele finalizaria tudo isso porque o pt destruiu a minha vida,direita
957,"1,04837597908799E+018",quer aprender a fazer salsicha,
958,"1,18319826555205E+018",1 cansado de pegar transporte público em situação irregular e desconfortável o passageiro da viação 369 enviou essas fotos vale ressaltar que isso foi ontem literalmente numa sexta feira sentido central do brasil ,
959,"1,18307886575908E+018", por nada 👍,
960,"1,18310174972232E+018", estão instituindo o caos promovendo o estado onde a justiça protege os criminosos e penaliza o cidadão pagad…,
961,"1,18121136009875E+018",iron maiden e o sistema eterno de jumentos ,
962,"1,17758760011639E+018",parabéns ,
963,"1,18319946846174E+018", porra marcela q susto desgraça ,
964,"1,18320013199225E+018",o macron tem que sentir na pele que não é a amazônia que está queimando e sim paris ,direita
965,"1,18260532712195E+018", mais uma noite espetacular conquistamos os três pontos e seguimos firmes no obrigado pelo show nação vocês s…,
966,"1,17971379193798E+018",hipocrisia no rock in rioo povo que gritava salvem a amazônia e do outro a comlurb contabilizando 1622 toneladas de lixo nos primeiros dias do festival de rock,esquerda
967,"1,18672523550621E+018",confirmados2810  sp 19h na da fradique2910  rj19h na da voluntários da pátria3010  bh 19h na livraria leitura3110  cuiabá no 011  goiânia 18h na puc goiás campus v051  poa 18h30 na ,
968,"1,183194006228E+018", eu na minha vida jamais soube de uma menina enfiando um crucifixo na vaginaas fantasias sexuais da ministra damares s…,esquerda
969,"1,18260908112058E+018",bom dia para quem está com reportagem publicada em gaúchazh na no e no 🎫 ,
970,"1,18316673998461E+018", o único erro da história do brasil foi deixar de ser uma monarquia,direita
971,"1,18318181600352E+018", queria comer algo gostoso hoje,
972,"1,17628360141719E+018", eu logo menos,
973,"4,77698269780501E+016",vamos contribuir novositebambi,
974,"1,18318086966783E+018", tem que ter uma paciência dos caralhos mesmo hein c i n i s m o s a t a n i c o 😈 🤣,
975,"1,18238870390745E+018",sds do meu ex ,
976,"1,18232504711511E+018", us turns down brazil’s oecd bid after publicly endorsing it in a leter pompeo says trump only backs argentina and…,
977,"1,18736284550946E+018",audiência pública sobre sofrimento psíquico dos trabalhadores da segurança pública e da educação a saúde mental dos profissionais de duas das principais categorias de servidores do estado precisa ser levada a sério ,
978,"1,15678567616104E+018",somostodoscaiocopola,
979,"1,15332716897965E+018", fato ,
980,"1,12145467168671E+018",todos convidados evento gratuito ,
981,"1,18313641968393E+018", quando voce junta principe pastores bolsonaristas em um lugar so nao sei como o capeta nao ta sendo palestrante nesse congresso,esquerda
982,"7,38089155847148E+017", yes,
983,"1,18421018317992E+018",e olha a esquerda roubando o povo pt faz campanha para pedir dinheirodo povo para soltar o ladrão lulamolusco inacreditável como a população ainda cai nessa pegadinha kpt afundou o paísptnuncamais luladrão,direita
984,"1,13395066764569E+018", a bola giratória so serve de enfeite mesmo mais nada,
985,"1,13279331276159E+018", que desespero,
986,"1,18320761165675E+018", a oposição ao bolsonarismo não se chama esquerdao nome é sanidade,esquerda
987,"1,18317975634863E+018", vão comer até as caixas do tarja preta,
988,"1,18260591207218E+018",mais uma conquista continuamos na luta segueolider flamengo ,
989,"1,18714352341553E+018",o nível das conversas desconstrói tudo que tentam macular ao brasil vamos ganhando a confiança de outros países e mostrando um brasil confiável e querendo desenvolver negócios sem amarras ideológicas coisa exclusiva no passado vamos virando o jogo,direita
990,"1,08522962406859E+018",vc é o que tem de pior em nossa política pode até correr mas não pode se esconder e o que é seu está guardado ,
991,"1,18168884248463E+018", veiculação o tcu proibiu a vinculação da propaganda do pacote anticrime avisem as tias do zap …,
992,"1,18319674655135E+018", arrascaeta eu te amo❤,
993,"1,16958941696229E+018", ontem o escreveu uma série de twets fazendo comparações absurdas entre a economia brasileira e a chilena.,
994,"1,18266140214367E+018",apresentei um projeto na câmara pra que a polícia federal assuma a responsabilidade de investigar as milícias todos nós sabemos inclusive o ministro da justiça sergio moro como as milícias estão entranhadas no poder ,esquerda
995,"1,18196979650362E+018",leiam os comentários na postagemuma pessoa incrível com uma voz espetacular mas com a alma ferida nem mesmo o dinheiro e a fama são capazes de prencher o vazio dentro do peitomuitas ,
996,"1,18698078525085E+018",ensine às crianças o valor das coisas não o preço bom dia ,
997,"1,18707289755213E+018", eu sempre achei q a briga era pra poder criticar político sem patrulha pra te achincalhar me enganei a briga era para…,
998,"1,18308666287369E+018",ficar na cama o dia inteiro só é suportavel no começo ta foda,
999,"1,18104736676338E+018", é assim que parte da sociedade menos informada é enganada,
1000,"1,18309405603495E+018", o tesão acumulado entristece o ser humano,
1001,"1,18628805647267E+018",esse ano abrimos processos seletivos em todas as regiões do brasil contemplando 19 estados suas capitais e muitos outros municípios a expectativa inicial era de abrirmos em 60 cidades mas graças aos filiados e o trabalho das lideranças locais pudemos abrir em 68 municípios,
1002,"1,07029787377709E+018",socialfishneptune version are cominggt execution time cloning by useragentgt web interfacegt logs in databasegt get al the getpost requestcokies useragent user login etc,
1003,"1,18320951758631E+018", alnavío entre maduro y rusia sólo hay anuncios que se repiten y no se concretan ,
1004,"1,18225608538789E+018", aproveitem não é todo dia que a gente pode acordar e ler uma crônica como esta do ⁦ 🍎 🍏 ⁦ …,
1005,"1,18320238769294E+018", ninguémabsolutamente ngmos assassinos em filme de terror ,
1006,"1,17466047422863E+018",4,
1007,"1,17773663227713E+018",yeah yeah yeah yeah yeahˢʰᵒʷ ᶠᵒʳ ᵐᵉ,
1008,"1,18266484286134E+018", 수빈입니다오랜만에 우리 다섯 멤버들이 함께 무대에 올라서인지 더 열심히 하고 최선을 다했던 행복한 무대였던 것 같아요모아분들 응원 들으며 너무너무 즐거웠어요 고마워요우리 곧 만나요tomorowxt…,
1009,"1,18311415954792E+018",me mudei de lugar ,
1010,"1,18200554941368E+018",a instituição que fica na bahia terra da minha família já atendeu milhões de pessoas humildes doentes em seus leitos hospitalares além disso diversos centros educacionais espalhados ajudam crianças a se qualificarem para o futuro,
1011,"1,16578680159382E+018",expectativa pra saber quem vai ganhamasterchefbr,
1012,"1,18638646146726E+018",o foi ao stf para anular a votação de agosto na câmara que aprovou a lei de abuso de autoridadegilmar mendes rejeitou o pedido e advinha o que augusto aras fez comunicou ao stf que não vai recorrer da decisãoestá só começando,
1013,"1,18560776451462E+018",hoje a inicia a rodada de audiências públicas sobre orçamento para o ano de 2019já estou na subprefeitura de pinheiros para discutir o orçamento da própria região além de butantã e lapase você é de alguma dessas regiões compareça seguimos até às 1730,
1014,"1,18159013605794E+018", eu senti a indireta,
1015,"1,18319438293523E+018", vc se estressa com qualquer coisinha “eu nao ,
1016,"1,99596860535616E+017",domingo espetacular mostra a influência de carlinhos cachoeira sobre a revista veja via ,
1017,"1,18310616945333E+018", k eu não to bem,
1018,"1,09542249260331E+018", ao incentivar hospitais psiquiátricos eletroconvulsoterapia e comunidades terapêuticas muitas vinculadas a setores re…,
1019,"1,18320331431128E+018", rompe el cerco mediático📺 en ecuador🇪🇨 e infórmate minuto a minuto de la situación de las cales del país a través de teles…,
1020,"1,18319116469187E+018", e se breaking bad fosse no brasilestou com câncer preciso pagar meu tratamento não sr walter existe tratamento gratuito,esquerda
1021,"8,75532134529868E+017",bandamemory  ao vivo na tiquatira zl,
1022,"1,18320188105049E+018", preciso trincar a barriga até dezembro será se da tempo,
1023,"1,18230260263096E+018",hoje é dia nacional de luta contra a violência à mulher a conscientização e a formação também são ferramentas nesta luta em 2017 criei a emancipa mulher uma escola feminista e antirracista que auxilia mulheres no combate às estruturas do machismo do racismo e da violência ,esquerda
1024,"1,18248184784824E+018", fragmento de mensaje de fidelcastro a la diciembre 27 de 207es necesario seguir marchando sin detenerse u…,
1025,"1,18310262061496E+018", para trabalhar é só começar crítica não atrapalha muito ao contrário,
1026,"1,18312805332672E+018", mesmo distante amo o meu timbu de coração,
1027,"1,17848134997761E+018",desisto do amor vai ser melhor k,
1028,"1,1820250217132E+018",o sofreu um infarto ele foi atendido pelo hospital do coração onde passou por um cateterismosegundo comunicado do governo felizmente ele está bemforça na recuperação,
1029,"1,17849780843072E+018", eu nas festas ,
1030,"1,11408552964828E+018", querem continuar a esculhambacao vamos acabar com essa safadeza esta passando da hora de acabar com essa ideologia impositiva não confundam liberdade com libertinagem,direita
1031,"1,1802313733297E+018", é muito sério o que esta acontecendo nas praias do nordeste já se tem notícias de animais sofrendo e o mistério segue,
1032,"1,18187662959068E+018", tcu acha que propaganda do pacote anticrime incentiva sensação de insegurança e claro não é todo mundo que tem 10 segurancas,
1033,"1,18320696925303E+018",el éxito de ventas es seguro la vida del artista desde sus propias palabras ,
1034,"1,18207322479806E+018", saneamento não avança no brasilem 10 anos só evoluímos 2 no acesso à água tratada e 12 na coleta de esgoto10 milhões de…,
1035,"1,18317173220884E+018", eu e minhas amigas chegando no dia do juízo final pra uma defender a outra ,
1036,"1,18247985130084E+018", valeu obrigado yjb 🦢🇧🇷🏴󠁧󠁢󠁷󠁬󠁳󠁿,
1037,"1,18229956770396E+018", qualquer projeto político que realmente tenha compromisso com o povo brasileiro tem a obrigação de revogar a destruicao da previdencia,
1038,"1,17010993594806E+018", pufavô 🙏,
1039,"1,18310764667881E+018",eu amo um vídeo e vou salválo ,
1040,"1,18734795102425E+018", claro “piada”,
1041,"1,15289144767648E+018", por que bolsonaro ataca porque seu governo paga o maior salário do país aos professores ao invés de transf…,
1042,"1,18301751883693E+018",tculiberepacoteanticrime tcuvergonha somostodosmoro somostodosbolsonaro somostodoslavajato pacoteanticrimeja pacoteanticrimesim pacoteanticrime reformadaprevidencia previdenciaoumorte reformadaprevidenciaja stfnaomerepresenta stfvegonhanacional tcuinimigodobrasil ,direita
1043,"1,18210241767818E+018", nem tenho roupa pra isso ,
1044,"1,18161150879667E+018", vc está bem desinformado amiguinho segue a abaixo o que determina o tratado mercosulunião europeia 👇,
1045,"1,18266536348344E+018", bom diaa julia explicou direitinho aqui ,
1046,"1,14384831175921E+018",tentando voltar a admirar o confesso que está difícil,
1047,"1,17794143102715E+018", pão de sal é a melhor coisa do mundo misericórdia,
1048,"1,18280361396767E+018", olá pessoal temos um grupo no whats sobre política e atualidades venham participar ,
1049,"1,18320075287926E+018", vamos aumentar a correnteesquerdista e gritar lulalivre  companheiros 🚩 ,
1050,"1,18232082656729E+018", acontece demais é um tal de dividir herança de milhões de dólares com você proposta de sociedade  casamento e vai por ai a foraa maioria militar americano,
1051,"1,18320379162735E+018",barney não votaria no bolsonaro nem a pau a personalidade dele é anticonservadora marshal ia de marina e robin de hadad nenhum votaria no bolsonaro ,esquerda
1052,"1,18262930982506E+018",tirando ver minha mãe e minhas irmãs eu do vou pra arco por causa da maga viada e da maga sapatao,
1053,"1,17983832315575E+018", até qnd a vai deixar no comando do pq claramente a função dele no programa é corta o e dá razão pra chatitoa diretoria deveria colocar outro pra apresentar o programa e deixar só como comentarista,
1054,"1,18247784681351E+018", 6n8hk9ekfd 1 compra,
1055,"1,18306895804546E+018", tu viu que eles tiveram que aguentar essa ,
1056,"1,182407137429E+018", na prática vão reduzir ainda mais os salários menores da base da pirâmide mantendo supersalários intactos principal…,esquerda
1057,"1,18274735253007E+018", qhem745ma 15 reais 1 pedido,
1058,"1,18083905925988E+018", que os pais e mães deste país se lembrem sempre que a falta de proteção social que seus filhos terão ao crescer e envel…,
1059,"6,8524377650015E+017",slash boss,
1060,"1,18028494118943E+018", tá idai tô apaixonada,
