,id,normalize,posicionamento
418,"1,18321100584273E+018", en imágenes violencia en ecuador descargó ataques sistemáticos contra tres medios de comunicación ,
419,"1,09897442675284E+018", dia de galo  bom dia ,
420,"1,18320523515151E+018",gostava tanto de vc,
421,"1,17831339906901E+018", é isso aí neymar foco e fé seja humilde jogo com alegria deus te abençoe🙏,
422,"1,09296667184366E+018", sua lógica inversa é de uma estupidez fantástica parabéns,
423,"1,10546499393019E+018", mídia é alvo de bolsonaro no twiter a cada 3 dias ,
424,"1,17254202585978E+018", ftrfvct,
425,"1,18313982937208E+018", essa foi bem no rim 🤣,
426,"1,12303622056777E+018", aprendemos que mais vale uma adaga na mão do que dois dragões voando gameofthrones aryastark nottoday …,
427,"1,16025353345268E+018", gado,
428,"1,09020735448067E+018", doar um bandido entra na sua casa rouba tudo o que você tem mata pessoas da sua família destrói o seu espaço emocio…,direita
429,"1,18313590685478E+018", juro que eu queria sabe onde vocês estavam entre 2010 e 2018,
430,"1,10947921805487E+018", ou então está querendo que o governo sente logo com ele para negociar cargos e outros favores políticos em função da aprovação do projeto da previdência,
431,"1,17337235675832E+018", estou completamente arrepiadopúblico saindo da bienal com o livro lgbt em mãos e protestando contra os agentes da censur…,
432,"1,18319244569521E+018", basketbal penis🏀 🏀 🏀 🏀 🏀 🏀 🏀 🏀 🏀 🏀…,
433,"1,18320364609335E+018",vari ,
434,"1,17873754459648E+018", direito a perversão externado com algum intuito,
435,"1,18291328683415E+018", i fel sorry for those afected by the typhon my prayers and thoughts are with them prayforjapan 🇯🇵…,
436,"1,18672076672702E+018",segundo filhos de bolsonaro lideram grupo de funcionários que criam perfis falsos nas redes sociais e que parte desse esquema funcionou até mesmo dentro do gabinete da presidência fala mais joice é bom que o brasil saiba toda a verdade ,esquerda
437,"1,18280645444682E+018", esse ze mané n cansa de passar vergonha msm né 🤦🏿‍♂️ ,
438,"1,07616165933557E+018", nos eua o preço na bomba flutua diariamente sobe e descemas pela sua constatação independente das regras tributarias de cada pais as regras de mercado aqui devem ser diferentes das de lá néaqui você constatou que só pode subir e que valorização de estoque  prejuízo,
439,"1,18158255435018E+018", eu digo pra você renunciar pra gente esquecer que você existiu,
440,"1,18159010760796E+018",delação do paloci tem muita coisa matéria jornalística até final de 2020 e vcs preocupados com bolsonaro sobre psl por quê serámuitos anunciantes envolvidos k edicao10,direita
441,"1,18204154310601E+018", juntese ao na luta contra a injustiça no próximo domingo dia 13 estaremos nas ruas pela liberdade de ,
442,"1,18230191959695E+018",sou antifascismo com rigor ,esquerda
443,"3,4406905039514E+017",meu companheiro desta viajem cfncwb ,
444,"1,18319129911518E+018", um plot desses pra filme lgbt pfv realize um sonho ,
445,"1,18310168869515E+018",real beauty body amp emotional formats druid study 4 d comon normative amp from personalities who show themselves in d general press models that show weve 2 b a stereotype of we se in advertising music films that d masses aprove saturdaythoughts ,
446,"1,18313736731981E+018",jetski e uma palavra ou duas tipo jet ski ou jetski,
447,"1,18310813324328E+018", tem gente que sai da sua vida querendo fazer falta e acaba fazendo um favor,
448,"1,17742816049907E+018", fica assim não,
449,"1,18168312655432E+018", whatsap admited that the ap was used during brazils 2018 election to disseminate massive amounts of ilegal messages…,
450,"1,12226598518724E+018",contra o fim dos conselhos participativos diga não ao decreto 97592019  assine a petição via ,
451,"1,17658309343783E+018", e usam dos mesmos jargões,
452,"1,18025998887653E+018",um evento que visa debater o modelo mais apropriado de reforma tributária no brasilinscrições através do site que consta na imagem em universidade da amazônia  unama ,
453,"1,11165623125978E+018",parece que quando vc pega ranço de alguém oa infeliz aparece em tudo quanto é lugar até andando no seu teto,
454,"1,18154736030179E+018", governo lula reduziu pobreza do país em 506 mostra estudo  jornal o globo ,esquerda
455,"1,1827811114093E+018",altos salários inúmeros privilégios e programas como o bolsa empresário são alguns exemplos de como grande parte do dinheiro público beneficia políticos a elite do funcionalismo público e donos de empresas ligadas ao estado,esquerda
456,"1,18243688012784E+018", ninguém quer vir mais ao brasil bolsonaro transformou o país num câncer internacionalcom menos rotas decolagens entre…,esquerda
457,"1,18678429605012E+018",a câmara dos deputados pode votar na noite desta terça a ampliação do porte e da posse de armas no país explica por que mais armas significam mais mortes ,esquerda
458,"1,17138040547755E+018",partido pre  tarjetón morado al concejo de bogota  19 ,
459,"1,18319937902232E+018", foi isso que o buarque disse essa é a razão para o bolsonaro não assinar segundo ele,
460,"1,1819765740501E+018", a petrobras é a estatal mais rentável entre todas as estatais não é um custo pro governo pelo contrário gera grandes receitas tanto pela lucratividade quanto pela distribuição de dividendos o governo deveria intervir menos e colher os frutos não implodir a mesma por dentro,esquerda
461,"1,1812747943749E+018", hahahaha foi aqui no ceará k,
462,"1,1831097864366E+018",dormiu ,
463,"1,15493465117108E+018", gado não entende essas coisas,
464,"1,16632049591194E+018", maisfundaonao,
465,"1,07646004486097E+018", como o mbl monopolizou as fábricas meméticas de direita no brasil ,direita
466,"1,18319694344033E+018", é muito grave e extremamente cruel o ins da gestão bolsonaro ter rejeitado 5 dos pedidos que foram feitos de aposentado…,
467,"1,18311343766627E+018",druid tips honesty is magic r u gay omit 4 those dont get u dont flaunt online amp expect em 2 say nothin dontcha want talk bout tel people u trust 2 know be4 u tel ur virtual pals financial independence is nedy be4 comin out thursdaywisdom ,
468,"1,18268343984315E+018",paiu bgs encontro vocês lá 😆 ,
469,"1,18279134017171E+018", será vc esse arrependido,
470,"1,18316428945836E+018", “deputados do psl invadem escola no rio” pra se matricularem na quinta série ,esquerda
471,"1,18265693690022E+018", beira não vejo otávio guedes desse jeito não um dos melhores comentaristas o presidente convenhamos não se ajuda,
472,"1,17909712336876E+018", a justiça brasileira está sendo carcomida por dentro  há legisladores e juízes que legislam e criam jurisprudência qu…,
473,"1,18127402742132E+018", kk a primeiras namoradinha era assim até hj não esqueci ela,
474,"1,18308049739361E+018", aproveita e pede um vale 😅😂🤣,
475,"1,12787815379027E+018", hadad sempre,esquerda
476,"1,18308033512444E+018", e mesmo assim ficam repetindo que foi “vc que fez minha cabeça” como se eu nao tivesse passado por isso na era pt e nao fosse capaz de identificar o esqueminha,
477,"1,1383434895053E+018",quando a lei é falha sobra a justiça a qualquer preço parabéns moro a verdade esta acima do seu cargo ignorar é o mesmo que defender direitos humanos para as monstras que castraram e mataram o filho de uma delas ou o assassino do ator que fez o paçoca,direita
478,"1,18246033316583E+018", falase tanto da necessidade de deixar um planeta melhor para os nossos filhos e esquecese da urgência de deixarmos filhos…,
479,"1,17862602278853E+018",monday already started ,
480,"1,18301400633381E+018", 👏,
481,"1,18674371015702E+018", em breve mais informações  equipe,
482,"1,17544222813689E+018", você fala muita bosta,
483,"1,17985601341296E+018", este ministro e maluco defende bandido e ataca procurador e ministro da justiça tudo errado neste país aqui o crime compensa porque sempre alguém ganha ,direita
484,"1,18046625610693E+018", eu já apresentei um projeto pra anular esse novo decreto nas armas de bolsonaro que dá brecha pra que civis comprem fuzi…,
485,"1,17527764890757E+018", uma criança de 8 anos a agatha foi baleada agora no complexo do alemão 😭😩,
486,"1,18012918157481E+018", de chocolate o baldasso entende mesmo k maior comedia o rgs,
487,"1,17144514178718E+018", hum tom selers,
488,"1,1820416156927E+018", se ha convertido en el preso político más notorio del mundo como lo han lamado desde chomsky hasta melenchon…,
489,"1,18193248566553E+018",p que tô ficando trouxa por quem não merece,
490,"1,18320325991541E+018", vai me fazer perder tempo lk,
491,"1,18288915425181E+018", a verdade é que a gurizada colocou os dois marmanjos pra correr 🤣,
492,"1,18318096762584E+018", concordo com você neste contexto quando me referi a defesa da constituição me refiro aos trabalhos da senadora principalmente agora na cj e devido aos retrocessos desse presidente que não possui capacidade política sendo uma ameaça a soberania nacional,
493,"1,18280336404168E+018",amadas bebam uma taça de vinho enquanto escrevem tc super recomendo tudo flui,
494,"1,07628029811828E+018", preso político kk,
495,"1,1811879154367E+018", o final k ,
496,"1,18243471715884E+018", já que não tem 1 especialista em futebol mineiro espera as outras emissoras sérias darem a notícia depois copia e cola no site de vocêssei que essa babozeira da fox da audiência mas podia simplesmente parar de falar dos times fora do eixo,
497,"1,18315557884519E+018",erundina sempre do lado certo da luta em defesa do direito conquistado das cotas de candidaturas femininas que garante mais representatividade no parlamento e participação feminina na política orgulho de lutar e aprender ao seu lado ,esquerda
498,"1,1806905024983E+018", o mestre veio caralho parabéns madrinha ,
499,"1,18319881099613E+018",ta flopando,
500,"1,15396415168704E+018", 🤣👏🏻👏🏽👏🏿,
501,"1,15071451615976E+018",bomdia boasemana ,
502,"1,17337133777307E+018", foi um resultado interessante de analisarapaguei a enquete pq qlq enquete dessa q fique no ar por mais de 20 minutos os…,
503,"1,18317217807177E+018", people like you are the ones who keps humankind por and underdeveloped asking for authority and government control making everyone por and kiling milions of people then blaming capitalism,
504,"1,18299190429375E+018", o brasil vai dar certo apesar da corrente contrária ,
505,"1,18678948126681E+018",infelizmente a reforma da previdência de bolsonaro e guedes conseguiu ser aprovada no senado a população será penalizada em um sistema previdenciário injusto e desleal que aprofunda desigualdades e não combate privilégios nós votamos não a história cobrará quem apoiou,esquerda
506,"1,17811836687736E+018",geraldo prado fundador da maior biblioteca rural do mundo bahia indignado afirma que professores não são muito chegados a ler tem muitos que moram do lado da biblioteca e em 19 anos não pisaram lá para pegar um livro nem de autoajudaisto é uma vergonha ,
507,4607896643,é finalista do prêmio planeta casa 209 na categoria projeto arquitetônico da editora abril,
508,"1,18282380828317E+018", acordem meus amigos paladinos levantem e vão para seu trabalho sua aula ou qualquer que seja sua obrigaçãoa noite s…,
509,"1,18194733860201E+018", a obra simples que me fez chorar hoje no masp a artista pediu que ambos os empregados e patrões desenhassem sobre o map…,
510,"1,18267935117696E+018",bacurau na maior ocupação de são paulo no dia 1 de novembro faremos uma exibição popular de bacurau na ocupação vila nova palestina do vamos ,esquerda
511,"1,18315416174085E+018", ngm de friends votaria no bozo e é por isso que a gente ama tanto eles são todos sensatos o ross é professor a rachel é…,esquerda
512,"1,18302283093972E+018", coitado porque será que o mestre foi desconvidado né alguém poderia dizer para ele tadinho 🤣,
513,"1,1863155369862E+018", voluntários do mbl pernambuco estão agora na praia do paiva ajudando a limpar o óleo que atinge a região valeu ,direita
514,"1,18170623260592E+018", kk pega fogo cabaré k,
515,"1,18281018335499E+018",1 meninas de 10 a 14 anos gastam 50 mais tempo se dedicando a trabalhos domésticos em comparação a meninos da mesma faixa etária cerca de 50 milhões de meninas e mulheres não têm acesso a banheiros para praticar uma higiene adequada durante seu período menstrualdiadamenina,neutro
516,"1,18275934837794E+018",na véspera do dia dos professores foram essas meninas e meninos que deram uma aula os deputados que quebraram a placa de mariele invadiram o colégio pedro i para fazer provocações foram recebidos pelos alunos e alunas assim ,esquerda
517,"1,10514485582571E+018", indentificado 😂 olha o presidente de vocês aí 🤦🏾‍♂️,
518,"1,18190388445913E+018",saiba como funciona a militância petista em ambientes virtuais ,direita
519,"1,18313730697225E+018", eu odeio calor,
520,"1,15762902448889E+018", eu com 10 anos pesquisando fotos capa para facebok no gogle,
521,"1,18302116369548E+018", bancos batem recordes sucessivos de lucros graças aos mecanismos que “criam” dívida pública enquanto isso a dívida externa aumenta.,esquerda
522,"1,18703115294885E+018",a câmara segue debatendo essa semana o pl da traição de bolsonaro que aumenta a desigualdade entre a base e os militares de alta patente ecou a pergunta feita pela maioria dos militares bolsonaro pretende se eleger apenas com votos dos generais ,direita
523,"1,18170787628231E+018", quanto é 8x7,
524,"1,16252098192103E+018", real que saudades,
525,"1,18318253182437E+018", vc aeu viu fica provocando dps n quer q eu me apaixone,
526,"1,18319719182701E+018", quase não traz 3 pontos o karalho,
527,"1,18314542971171E+018",círio de nazaré ❤️🙏 ,
528,"1,18202310018511E+018",com a saída de bolsonaro do psl bivar se torna o mais recente homem de 359 milhões de reais com brigas internas e priorizando os caprichos de eduardo e flávio qantos da bancada acompanharão o presidente,
529,"1,18208100636451E+018",acho que se minha família tivesse feito isso ao invés de mandar eu mudar emagrecer pra agradar os outros eu não teria metade das inseguranças que eu tenhomas eu de vd não culpo elas por terem feito isso elas tbm tavam mal,
530,"1,11342526286626E+018", taurino é bilíngue fala português e coisas por impulso,
531,"1,18205351684149E+018",hein rameira ,
532,"1,1823349412182E+018", nessa analogia a cidade n teria mais habitantes kporém vamos na sua analogia sem sentido como funciona a democracia a maioria ganha correto eu acabei de dizer sobre o fato do cristão que votou em nome de deus e da sua religião afim de levar inconsciente mente o brasil,
533,"1,18237552250189E+018",é bis ,
534,"1,18301855541721E+018", o problema é quando a pessoa é questionada sobre aborto tenta sair como isenta e diz que isso tem que ser decidido através de um plebiscito hipocrisia soucontraaborto abortonão provida brasilconservador bolsonaropresidente bolsonaro202 somostodosbolsonaro,direita
535,"1,18283419335469E+018", o mais alto da superliga vai ser o renan buiati com 217 m jogando pelo campinas voleinosportv,
536,"1,18669681481003E+018", estou jurado de morte e a minha segurança é formada por agentes da segurança pública são profissionais treinados para isso algo bem diferente é armar civis pela sua lógica torta eu deveria pedir o porte de arma para mim sou contra a segurança é papel do poder público,esquerda
537,"1,18244570991786E+018", expõe a hipocrisia do presidente bolsonaro fez a reforma da previdência porque não tinha dinheiro mas isentou um trilhão das multinacionais ,esquerda
538,"5,84139239912243E+017",amominhafamilia,
539,"1,12448873333043E+018", anti machismo nerd sempre,esquerda
540,"1,17188590112078E+018", melhor resposta,
541,"1,1793818626844E+018", rancinho,
542,"1,18319170001512E+018",ai bixa que bgs2019 foi esse arrasaram nessa bgs amei pecax pena que não pude ir mais assistir a live ,
543,"9,65617177465377E+017",amores aproveitem as compras cupom de desconto chama no pv ,
544,"1,18230079215969E+018", to mt triste mais um caso de racismo meu maquiador tá participando de um concurso de make e eu sou a modelo dele,
545,"1,18302841519412E+018", quem não é homem é você de postar essa porcaria ao invés de se dirigir a direção do programa por meios oficiais melhor é homem um homem covarde vergonha da raça,
546,"1,18713046635013E+018",em reunião com diversos representantes de hospitais com o ministro da saúde e o deputado para tratar de assuntos relacionados a saúde do estado de são paulo trabalharei sempre pelo melhor do estado de são paulo e do brasil ,
547,"1,18320519084713E+018",yes and because last dentist i went theresa jones of gulfport ilegaly implanted a chip in my gum for the nsa target of organized comunity stalking here in gulfport ms at the oaks apartments by the trump deplorables are you going to help us14 on nsa list get wel son ,
548,"1,1831768448892E+018", hoje eu encontrei uma garota chorando fora do mcdonalds e quando eu fui perguntar o pq ela disse que tinha perdido 30 reais,
549,"1,17656503556662E+018", vc não assistiu ao discurso houve aplausos sim até mais do que eu imaginava depois dele falar tantas verdades na cara dos comunistas,direita
550,"1,18128502142604E+018", uma na quarta série do primário que era sensacional queria ter tido mais professoras como ela,
551,"1,18042449135428E+018", lula livre mariele anderson presidente fora bolsonaro moro na cadeia investigação na vaja jato já,esquerda
552,"1,16936076299492E+018", musadosmemes qdo chegar em casa vou limpar toda a casa e estudar  chegando em casa ,
553,"1,152363069798E+018", nunca,
554,"1,18213599257004E+018", parabéns,
555,"1,18131103101405E+018", é um excelente time mas o time de 1982 que eliminou o brasil era melhor acho que só o pirlo tinha vaga naquele time,
556,"1,173376890415E+018"," com os novos diálogos da vazajato a credibilidade do exjuiz e atual ministro da justiça sérgio moro que já estava conturbada, piorou",esquerda
557,"1,17912623740031E+018", e aí bolsominion já foi pra avenida paulista com a camisa da cbf com o pato da fiesp e batendo panela contra o gilma…,esquerda
558,"1,18227146647533E+018",sérgio moro meu heroi,direita
559,"1,16291638280525E+018", vai lava o cu k,
560,"1,18210116033917E+018", vai pro pcdob seu bosta,direita
561,"1,18241771227177E+018",resistindo à tentação em comparar bacurau com a hora dos ruminantes,
562,"1,15799623884473E+018", você não leu 10 livros na sua vida meu deus como pode ser tão limitado intelectualmente academicamente eu já conhecia a limitação mas consegue piorar vai estudar “ministro” o índio te deu um pito vagabundo,
563,"1,18246141230156E+018", aí miga k,
564,"1,18282046028483E+018", o sextou que eu queria ,
565,"1,18320088649293E+018", termino griego,
566,"1,18242428788355E+018", amanhã depois da aula,
567,"1,14016753818315E+018", como vocês bolsominions são patéticos se é que entendem o que falei bando de asnos,esquerda
568,"1,13048313252282E+018",melhor crítica ao final de got ,
569,"1,18209335546923E+018", tô vendo nada e não põe a culpa na mídia pois as declarações imaturas dele dão mais ibope,
570,"1,16924797338307E+018", ele vai tirar a calcinha pela cabeça k bicha super reprimida só fala de gay fora bolsonaro,esquerda
571,"1,18099901810258E+018", qm acha qualquer gato feio nao eh uma pessoal confiavel ,
572,"1,18274791963773E+018", premiê da etiópia abiy ahmed ganha o nobel da paze o lula continua preso e sem nobel babaca 🤣,direita
573,"1,18312983756692E+018", take careau ziam onde a mãe de zayn é internada em estado grave com um a doença rara e liam é o médico responsável por…,
574,"1,1799662280829E+018", a única coisa que me tira do sério é o beijo que a gente ainda não deu 😔,
575,"1,18719501723806E+018",iso aqui é flamengo,
576,"1,18317755594958E+018", pro mesmo lugar que a galera do rir mandou qdo pediu anita ,
577,"1,18672505489108E+018",free lula ,esquerda
578,"1,18187795905923E+018", essas são provas que os alunos do colégio loyola de bh prestam se vc tem filho que estuda neste colégio abra o olho,
579,"1,17911879566488E+018", janot prova no livro que lula foi alvo de uma caçada da lava jato leiam via ,esquerda
580,"1,17732399623855E+018", a questão é que isso tem que ser imposto pela sociedade sem que o congresso interfira a democracia pode ser exercida diretamente pelo povo sim é o que diz a constituição,
581,"1,18298929234964E+018",fica aqui nossa homenagem às crianças brasileiras lutemos por um outro futuro possível 💛🌻 ,
582,"1,18685997558031E+018", circula pelas redes sociais um post com a informação de que o expresidente tem uma conta com 243 milhões de…,
583,3457335998,mercadante  que decepção,
584,"1,18068455369177E+018", é mestre obg pra todo mundo que acreditou esse momento é meu 🎊🎉🎊🔫🔥 ,
585,"1,18316562490375E+018", e cuidado às vezes vc cospe pra cima e volta pra garrafa fizeram todo esse barulho sobre mensalinho de psl com a mais alta,
586,"1,18046814920183E+018",na encruzilhada do mundo virtual para o realmais um amigo virtual que se materializa ,
587,"1,17482598675352E+018",prof custela apresenta a todos uma jovem muito inteligente que estuda na escola técnica virgínia patrick a belíssima daniela leonidio ,direita
588,"1,17074757821391E+018",faz qual jogo da nfl hoje nflnaespn,
589,"1,1761402399345E+018", problema é quando para queríamos que não tivesse parado como ocorreu na copa américa o povo não sabe o que quer,
590,"1,18201211177551E+018", Impeachemant do bolsonaro,esquerda
591,"1,18678250363131E+018",reforma da previdência aprovada economia de 80 bilhões poderia ser melhor sim mas é o que temos agora vamos para o pósprevidência tributária administrativa e privatizações,direita
592,"1,18319349627195E+018", a ironia como disfarce combinadinha no grupo de zap mas os fatos são inabaláveis na foto a mamata com dinheiro público para parentes do bolsonaro,esquerda
593,"1,18310006099066E+018",k ,
594,"9,23946692172493E+017", os caras foram campeões do mundo em 51 os fatos históricos são incontestáveis,
595,"1,1694281448703E+018",bachelet não era comunista hitler não era comunista e a terra não é plana 💜,esquerda
596,"1,18317703492898E+018"," alguém viu essa notícia na globo lixo ou na folha pois é não vão mostrar nunca mesmo ajudem a compartilhar, bolsonaro mito",direita
597,"1,16564323337397E+018",cuélar se complicando ,
598,"1,18316031058633E+018",ei ate quando você vai ficar assim com vergonha de sair passear  verão esta ai eleve sua alto estima sinta se poderosa adquire este ebok digital e 👉percapesodeverdade👈👉👈 produto com garantia ou devolução de seu dinheiro,
599,"1,17015083235829E+018", depois de john oliver na hbo hoje foi a vez de trevor noah detonar bolsonaro metade do daily show nesta noite se focou,
600,"1,1761526471052E+018",dr ítalo marsili sobre olavo de carvalho ,
601,"1,18302113135321E+018", tenha o mínimo de respeito pelas crianças e pare posar fazendo arminha com as pobres crianças inocentes pra foto,esquerda
602,"1,18094920692161E+018",eu odeio quando meus vizinhos começam a brigar,
603,"1,18314921188755E+018"," apoiado pelo o povo brasileiro, meu presidente bolsonaro",direita
604,"1,18737038946438E+018",entenda a ação ,
605,"1,1831590847465E+018", tem que ter capitalismo mesmo,direita
606,"1,11780411510565E+018",o cara é investigado por lavagem de dinheiro nos usa na venezuela e no brasil agora tem passaporte diplomático que maravilha ,
607,"1,1823573396697E+018",eu acho q vai chover,
608,"1,18229808732431E+018", sono,
609,"1,16546428618302E+018", enquanto o bolsonaro choraminga na tevê e na live que tá difícil arrumar dinheiro pra segurar a bomba que ele mesmo armou,esquerda
610,"1,18201674444723E+018",projeto proíbe cobrança de ingreso extra a pessoa com deficiência que ocupe mais de um assentoleia a matéria completa aqui ,
611,"1,18275867036035E+018", a bala tá comendo solta no r6s com as equipes e aqui no estande da xboxnabgs…,
612,"1,18205431477014E+018", minha deputada então pq o presidente não ejeta o ministroeu ejetaria,
613,"8,71826801655505E+017", desculpa mas não entendi sua resposta,
614,"1,1803160061888E+018", imagine que um grupo criminoso contou por muito tempo com colaboração de ministros do supremoimagine que tal grupo…,
615,"1,16824267449276E+018", acesse o código de defesa do consumidor e saiba mais sobre os seus direitos …,
616,"1,18127070458877E+018", arão está bem arão virou craque joga muito irmão abs,
617,"1,17876977745785E+018", quase 1 ano para aprovar uma uma lei importantíssima para o país e quando se trata de lei de abuso de autoridade ou aumento do fundo partidário para beneficiar corruptos é aprovado na calada da noite uma vergonha ,esquerda
618,"1,18314368938584E+018", apodi,
619,"1,18234351034059E+018",almoçar com meus avós é muito bom melhor forma de começar a quintafeira,
620,"1,18196375668912E+018",chico buarque merece o nobel “a não assinatura do bolsonaro no diploma é para mim um segundo prêmio camões” ,esquerda
621,"1,15438105918783E+018", a única coisa que não muda é que você é uma vagamundo ignorante vai estudar vai,direita
622,"1,18046529500734E+018", os ministros do stf fazendo licitação para comprar frutas por r30 mil ao mês senadores atrasando a votação da reforma…,direita
623,"1,18320178188036E+018",fogo no feno senhoras e senhores festaafazenda,
624,"1,18319685582137E+018", arrascaeta eu te amo❤,
