,id,normalize,posicionamento
0,"1,17658888166956E+018",eu não sinto nem um pingo de vergonha com o discurso paranóico e falacioso do presiloko quero vêlo exposto ao mundo para que todos saibam o que fizeram com o brasil sorry,esquerda
1,"1,18312982928312E+018", alíquota para as 40 famílias norteamericanas mais abastadas foi de 23 em 2018 enquanto os demais pagaram 244 segun…,neutro
2,"1,13278746241629E+018", a equipe vermelha,neutro
3,"1,18248342907563E+018",só queria ser fofinha com o giovani igual começo de namoro,neutro
4,"1,18193696127731E+018",curso relâmpago de marxismo para manuela dávila ,esquerda
5,"1,18223471091271E+018", atençãoo politz trouxe para vocês todos os vídeos que foram proibidos pelo tribunal de contas da união da campanha d…,neutro
6,"1,18317183128664E+018", jaden smith no lolapaloza ,neutro
7,"1,18205983415964E+018", a nossa campanha gratuita continua abaixo mais um vídeo para vocês compartilharemtculiberepacoteanticrime euapoi…,neutro
8,"1,1820026667734E+018", pode vir com tudo,neutro
9,"1,18315952716583E+018",qual o problema de vcs“rachel é patricinha filha de médico” a mulher saiu de casa no 1º ep foi trabalhar como garçonete tendo tudo oq ela queria e até a 10ª temp foi a personagem que mais evoluiu de patricinha p uma puta executiva feminista respeita minha personagem ,neutro
10,"1,17981395742455E+018",310 1418 hänsel o melhor grupo num trabalho de engenharia é ficar sozinho desprezo do joão pelo estudante de engenharia não cansa de me suprender,neutro
11,"1,18193615774098E+018",marcou como tenho perseguição skob,neutro
12,"1,18202698004217E+018",“a pior parte de ter uma doença mental é que as pessoas esperam que você se comporte como se não tivessecoringa 2019,neutro
13,"1,18316429738976E+018", os isentões são os liberais mesmo que se digam conservadoresé importante identificálos corretamente,esquerda
14,"1,18665777265552E+018",monja lembrou visita que fez ao expresidente na prisão em curitiba ,neutro
15,"1,17326485974147E+018", e o nosso ana use sua influência para nos ajudar 😔,neutro
16,"1,18082566128139E+018", alcançamos a meta deste ano para privatizações e concessões   menos estado menos cargos nas mãos de pol…,direita
17,"1,18310680153913E+018", o trecho não tem nada a ver com o tema em pautae arma alguma é parea para ministro de deus se teme não faça o mal,direita
18,"1,17952257585412E+018", olha que interessante,neutro
19,"1,18210807972016E+018",Eu apoio o pacote anti crime ,direita
20,"1,09696963492059E+018",give us what we wantcatfamily catmommywhiskers caturday ,neutro
21,"1,18316545500084E+018",ajude a divulgar a revolta popular contra ditadura neoliberal do governo do equador que a imprensa brasileira tenta esco…,esquerda
22,"1,0805967452671E+018", kk que situação mano,neutro
23,"1,18314079736291E+018", isso é coisa de gente pequena infelizmente essas pessoas mandam no braziu,neutro
24,"1,16528297430213E+018",Esquerdistas seguem esquerdistas impeachment do bolsonaro lula livre sabados ,esquerda
25,"1,18173225910525E+018", ane with an e ❤️,neutro
26,"1,18299534608511E+018",qual o problema do presidente incentivar uma criança a ser policial queriam que ele incentivasse a ser bandido é muito mimimi pra tentar atingir o presidente o brasil vai dar ceo não adianta torcerem contra,direita
27,"1,18311267356479E+018", nikita chanandler m bong,neutro
28,"1,1813162693222E+018", vai toma no cu mundo boa noite,neutro
29,"1,1826973014852E+018", que droga vocês usam meu irmão ,neutro
30,"1,18309477281634E+018",a verdade vencerá lulalivre ,esquerda
31,"1,1567508619657E+018", perceberam sua irrelevância,neutro
32,"1,18320102222066E+018", a realidade é que eles vão te encher de palavras bonitase no fim vão embora como todos os outros,neutro
33,"1,18195713662193E+018", esse pessoal só tá aí pra atrasar atrapalhar o desenvolvimento do país “veta” q proposta dela veta 🤨,neutro
34,"1,18312240435009E+018", fdase o lacre do tênis enfia no c,neutro
35,"1,17914456553991E+018", só tem colesterol quem faz exame,neutro
36,"1,17662855647616E+018", sim,neutro
37,"1,18137752290848E+018", achei essa foto tão linda caramba 👏🏽👏🏽👏🏽,neutro
38,"1,1714547380024E+018", quando vejo matérias que fulano perdeu 20 mil em golpe on line eu me pergunto como que gente burra tem 20 mil onde to erra…,neutro
39,"8,67555700788146E+017", estão brigando pelo interesse do povo ou pelos seus próprios interesses af,neutro
40,"1,18321039699338E+018", alnavío maduro está preso en el palacio de miraflores mientras guaidó se mueve libre por venezuela ,neutro
41,"1,18277187376089E+018", simples assim ,neutro
42,"1,18276392399868E+018",aglomeração obstrução e importunação com estas acusações a polícia de washington nos eua prendeu jane fonda atriz de 81 anos com outras 16 pessoas que estavam protestando pela preservação do meio ambiente o autoritarismo não tem fronteiras,neutro
43,"1,16977092725885E+018", quiero agradecerle a diego maradona el ofrecimiento que hace mucho estaba esperando lamentablemente el 179 en basilea s…,neutro
44,"1,18285484273538E+018",de película ,neutro
45,"1,17605485830417E+018", para de drama,neutro
46,"1,18270533238625E+018", esse aí já bloquei faz tempo 🤣,neutro
47,"1,18271215990783E+018", a prisão após 2º instância sempre foi aceita no brasil até políticos começarem a ser presos o stf a proibiu em 209 mensalão…,direita
48,"1,17880060112953E+018", é muito importante saber o que fazem os senadores quer saber mais sobre o senado confira htp…,neutro
49,"1,18279421595011E+018", mod ,neutro
50,"1,18269002670405E+018", this elizabeth warren answer was quite a moment at cn equalitytownhal ,neutro
51,"1,18681765478445E+018",em vez de fraudar flexões o presidente poderia estar trabalhando para limpar o litoral nordestino ,esquerda
52,"1,17832473504375E+018", ok tu realmente nunca vai superar o fato de eu ser consideravelmente baixinhaentaovamo sim,neutro
53,"1,1757825138826E+018", rip meu cruzeraun,neutro
54,"1,16065305353772E+018", presidente o senhor consegue falar paralelepípedos com o seu problema na língua,neutro
55,"1,181925380934E+018",quando a fama e a riqueza sobem a cabeçaelon musk diz ser “um grande idiota” por chamar mergulhador que ajudou no resgate na tailândia de “pedófilo” ,neutro
56,"1,18280282879396E+018",im enjoying the dors  roadhouse blues on classic rock chanel on ,neutro
57,"1,18088641456262E+018", fundadores da democracia americana temiam influência estrangeira via ,neutro
58,"1,18320157575969E+018", q belíssimo nome amiga ,neutro
59,"1,1812705569661E+018", existem pessoas q surtam por qualquer coisa e pessoas q chora por tudo qndo fica triste e existe eu q faço os dois,neutro
60,"1,18318111130176E+018",algum amg pfv venha na minha casa p invadirmos a festa do meu vizinho,neutro
61,"1,18316467804803E+018",eu com qualquer cachorro ,neutro
62,"1,18200039252528E+018",você vai para as ruas se manifestar pelo impeachment e depois a fraquejada boicota os votosa reforma desidratada essa pasa para que a esquerda maldita possa no futuro roubar cada centavo economizado blindados pela lei de abuso de autoridade,direita
63,"1,17577661960629E+018", nem aqui eu tenho pas,neutro
64,"1,18200296613338E+018", continuem usando a caixa2dobolsonaro porque os bolsominions não estão gostando e eu quero é gastrite atacada,neutro
65,"1,18267362878315E+018", que se fodam os dois mas é bom ver o doria se ferrar pelo menos um pouco,esquerda
66,"1,18242002265799E+018", tô te imaginando parada com as mãozinhas na cintura olhando pra essa semana dizendo rapaiz,neutro
67,"1,18163702827186E+018", tem partido político por aqui que se posiciona na cara dura contra leis severas para crimes e corrupção mas parte da politica,esquerda
68,"1,18310732485396E+018", quem tem não convida nós triste demais isso,neutro
69,"1,09094122204108E+018", como influenciar e matar pessoas 1 o que matou em brumadinho foi uma leitura da realidade e zema o imortal coletor de corpos,neutro
70,"1,18460126317613E+018",em defesa do brasil contra a entrega da embraer debate com professores alunos metalúrgicos na unifesp em são josé dos campos sp o brasil está se levantando contra essa negociata🌹 saiba mais ,esquerda
71,"1,18675775477982E+018", manifestação de pais e alunos das escolas santo agostinho e loyola pela liberdade de expressão de professores na educação m…,esquerda
72,"1,18306901765073E+018", vota em racista e vai à pé até o santuário de nossa senhora aparecida a santa negrahipócrita,esquerda
73,"1,17209691426493E+018",oo ,neutro
74,"1,18266940506863E+018", ao contrário do que diz bolsonaro o brasil durante o governo lula foi várias vezes sondado pelo secretáriogeral da…,neutro
75,"1,18305581140642E+018", esses são uma escória que não quer o progresso do brasila lista dos 10 maiores inúteis jornaleiros a serviço do…,direita
76,"1,17223423405817E+018", hahahahahahaha,neutro
77,"1,17986320562091E+018",ataques de todos os lados ,neutro
78,"1,11968333027703E+018",honrando as origens em feira de são cristóvão  centro luiz gonzaga de tradições nordestinas ,neutro
79,"1,1831820719987E+018", ops júlia k,neutro
80,"1,18278658352051E+018", às vezes há males que vêm para o bem o gabriel já está com mais de 32 mil seguidores no instagram eu entre eles que sua arte supere essa manifestação idiota de preconceito,neutro
81,"1,18245754188166E+018", hahahahahahahahahahahahahahahahahahahahahahahahahahahahahahahahahahahahahahahahahahahahjean wylys de direita…,neutro
82,"1,18297693696181E+018",no futuro o discovery chanel vai apresentar o bolsonaro e a sua corrente do mal vai vendo ,esquerda
83,"1,18678585681791E+018", ja subiu bateu recorde 1,neutro
84,"1,18737585012518E+018",fora salesricardo sales do novo é ele próprio uma tragédia ambiental o ministro atua conscientemente para beneficiar desmatadores e empresas poluidoras age com negligência proposital e bota sempre a culpa nos outros assine a petição ,esquerda
85,"1,1824044334031E+018", crlh que profundo mané,neutro
86,"1,18129476521365E+018",miniserieshbowhentheyseus realifeclown realifescapist ,neutro
87,"1,1711903464554E+018", é isso que eu sinto por vc klk,neutro
88,"1,18699068434519E+018",ontem a câmara aprovou por 329 votos a 86 o acordo bolsonarotrump que entrega a base espacial de alcântara ma para os eua e ainda expulsa famílias quilombolas toda a bancada do psol votou contra esse entreguismo vergonhoso para nós soberania e dignidade não se vendem,esquerda
89,"1,17977881154778E+018",é tão delirante o pensamento de que o pobre conseguiria pagar um plano de saúde se o estado não interferisse que a melhor coisa a se fazer é abstrair e fingir demência,esquerda
90,"1,1831436634609E+018", essa é para o felipe moura brasil jorna de vocês,neutro
91,"1,15223019305614E+018", comentario estupido é desnecessário ,neutro
92,"1,17548119253316E+018", pensei que a gente já tinha casado,neutro
93,"1,18314083963315E+018", você parece meu priminho de 7 anos,neutro
94,"1,18238021155755E+018",Niobio cash a criptomoeda do brasil para os brasileiros vamos apoiar e incentivar a ultilização de um ativo genuinamente brazuca niobiocash niobio,direita
95,"1,18665764043428E+018",segue a pressão para que o governo leite retire o pedido de urgência da tramitação do pl 4312019 que altera 480 itens do código ambiental gaúcho o tj o mp e mais de 70 entidades reivindicam ao governo o mais amplo debate sobre o novo código ambiental estamos nesta luta ,neutro
96,"1,18232994603274E+018", “apareci aleatoriamente ali e fiz o gol” 😂 ,neutro
97,"1,18265997548472E+018",vale a leiturabrasil na ocde ‘estamos colhendo a humilhação pública depois de todo festejo’ diz ricupero ,neutro
98,"1,18302078486595E+018", de certa forma todo mundo sabia que o caminho era esse existe uma versão um “dialeto” de direitos humanos que usa a ban…,neutro
99,"1,13754740857182E+018", estar com a sua família escutando belchior e tomando um bom vinho no conforto de sua casa a felicidade são esses moment…,neutro
100,"1,12373703039829E+018", 🤭,neutro
101,"1,18298036285673E+018", a luta continua companheira bom sábado,neutro
102,"1,18186085749771E+018", os protetores de bandidos não querem que a propaganda do pacote anticrime seja divulgada então já sabem a gente divulga …,direita
103,"4,97183814670901E+017",eu estou ouvindo rádio cultura fm 1033no realradio ,neutro
104,"1,18301428141312E+018",índia chega a mais de 30 mil suicídios de agricultores aponta dossiê via ,neutro
105,"1,18274585153129E+018", pegar minhas manias ok agr usar cm outras pessoas ai já é demais ne,neutro
106,"1,18247717080082E+018", serve 1 compra ifod 6n8hk9ekfd,neutro
107,"1,18126979959642E+018", quando seus amigos tiram sarro de sua maior insegurança mas você tem q agir como se isso não o incomodasse …,neutro
108,"1,18301481331791E+018", nicks é um poste,neutro
109,"1,18028188074845E+018", curioso sobre queiroz moro não fala sobre o ministro do turismo denunciado por corrupção também não fala menos ainda…,neutro
110,"1,18314384847161E+018", primeira santa brasileira irmã dulce se dedicou à classe trabalhadora ,esquerda
111,"1,17014290433513E+018",Volta pt volta pt volta pt lulalivre lulalivre lulalivre volta pt,esquerda
112,18553730395, thank you spain for geting the world cup for portugal ,neutro
113,"1,16426118377759E+018",evento de filiação psl  ariquemes rondônia 🇧🇷️ ,direita
114,"1,1820680600454E+018",lamentável a decisão do tcu que manteve a suspensão da propaganda do pacote anticrime que coisa mais pequena para o nosso paísa quem interesa não aprovar o pacote anticrime a sociedade quer espera e merece esa aprovação ,direita
115,"1,18309880120205E+018", beijar na boca é bom mas vc já levou um tiro nem eu vamo se beijar entao,neutro
116,"1,1816022126462E+018", como é acordar cedo escrever com entusiasmo depois ler o comentarios e perceber que não faz um bom trabalh…,neutro
117,"1,1824134186844E+018", do que adianta ter 20 reais of no uber eats se ele entrega pra cidade todinha menos pro meu bairro 🤠,neutro
118,"1,17960325883642E+018", seus livros são interessantes seria melhor que todos fossem em português,neutro
119,"1,1823003659848E+018", tinha é que estatizar tudo,esquerda
120,"1,16637159921127E+018", nesses aviões tem como levar nosso presidente pra israel e deixar ele lá pelos próximos 50 anos,esquerda
121,"1,18310904783227E+018",feliz dia das crianças ,neutro
122,"1,17219766938683E+018",dino homenageando bozolino ,neutro
123,"1,1870116261275E+018",essa modalidade para subsidiar estados e municípios precisa ser aprovada pelo senado federalcom isso consegui articular e colocar a matéria em pauta e votar emergencialmente na comissão de assuntos econômicos cae do senado logo em seguida foi aprovada também no plenário,neutro
124,"1,1826547342321E+018", se gritar chegou o papai náutico  não fica um,neutro
125,"1,1830753396412E+018",o pingo nos is e blogueiros de crachá  o que eu sei via ,neutro
126,"1,1801622536954E+018", ai sim esse é o meu presidente sempre trabalhando pelo povo,neutro
127,"1,12050228026723E+018", the internet is insane,neutro
128,"1,18268271818805E+018",as vezes acho que sou surtada pq jesus só faço merda vou tentar resolver o que não tenho culpa alguma e passo por loucaobrigada,neutro
129,"1,17194762521564E+018", fora diretoria iresponsansanvel,neutro
130,"1,18319013103081E+018", desodorante de milho,neutro
131,"1,18319754473574E+018", eu quero parar de chorar hoje mas a e o não me ajudam 😭❤️,neutro
132,"1,18275170542915E+018",não aparece quase mas estou lá no fundo 😂🏳️‍🌈📚🏳️‍🌈😂 ,neutro
133,"1,18319773391148E+018", nando deixou de ser conservador então pq foi desconvidado de um evento conservador pq critica duramente o governo…,direita
134,"1,15515292749919E+018", os espíritas não não generalize se algum irresponsável falou essa inverdade não deve responsabilizar o movimento espírita,neutro
135,"1,18317723804653E+018",he hurt me but it felt like true love,neutro
136,"1,18264200593718E+018",as nossas práticas políticas precisam refletir o que a gente quer ver transformado no mundo ,neutro
137,"1,18168151857559E+018", este perfil é team sergio moro eu apoio pacote anticrime ,direita
138,"1,18232498566849E+018", é de certa forma generalizando já que a grande maioria fala pela minoria de seus grupos religiosos e no mesmo pensamento os cristãos elegeram o bolsonaro e crivela em nome de da religião condenaram um país tão rico em diversidade então sim generalizando,esquerda
139,"1,15478502732402E+018", tem gente que prega o tempo todo ódio contra os muçulmanos tb em suas colunas e palestras além de ignorar.,esquerda
140,"1,18244697615734E+018",a renda rural em queda a indústria em queda livre o comércio quebrando o desemprego recorde a maior informalidade da história a pior década em matéria de crescimento econômico dos últimos 120 anos ,neutro
141,"1,18205331822028E+018",ospingosnois isso aí apoio 10,neutro
142,"1,18239134260288E+018",richard trumka presidente da maior central sindical norteamericana a aflcio e pepe alvarez secretáriogeral da maior central espanhola a ugt chegam à sede da polícia federal em curitiba para entregar o prêmio george meanylane kirkland de direitos humanos a lula ,neutro
143,"1,17866099649744E+018",mas arbitro não tem que falar com ninguém ,neutro
144,"1,15395827399076E+018", isso aí ta longe se ser no meio dos paraíbas vou te dar um exemplo mais claro ,neutro
145,"1,18275195683567E+018", Lei 492 jovens de hoje em dia sexo  bebidas  drogas  curtição eu atualmente  quero trabalhar  mora…,neutro
146,"1,18319949287677E+018",facilmente o melhor episódio dessa temporada,neutro
147,"1,12787765920628E+018", parabéns superar barreiras não importa em quais condições sociais é o que nos fortalece cada caso é um caso e uma história mas o sofrimento e a vitória são os mesmos,neutro
148,"1,18672727030154E+018",a cpi do bndes sem lula e dilma entra na seleta lista de absurdos como socialismo e liberdade impeachment de dilma sem a perda dos direitos políticos mensalão sem lula,direita
149,"1,18191678499321E+018", maro vc foi maravilha 🇧🇷 ,neutro
150,"1,18214740356418E+018",escola técnica virgínia patrick leva você a conhecer um pouco do bairro de copacabana o nome do bairro referese a imagem de nossa senhora de copacabana de origem boliviana a palavra copacabana vem da língua indígena quéchua kupa kawana que significa olhando o lago,neutro
151,"1,16529778792958E+018",quando a dilma falava em estocar vento na realidade era um plano maquiavélico e comunista do pt pra criar uma bomba de fumaça e prejudicar seus futuros adversários políticos,neutro
152,"1,18132645056321E+018",a palavra de deus fala por si é facil entender só não entende quem não quer em são josé santa catarina ,neutro
153,"1,18316717313461E+018", coração do tamanho do mundo nosso presidente visita de surpresa acd olha a emoção do garoto ao ver nosso p…,neutro
154,"2,40863783675888E+017",tão certo quanto 2 e 2 são 4 a vida vale a pena embora o pão seja amanhecido e a liberdade ainda não seja plena,neutro
155,"4,67004130578289E+017", quer viajar economizando muito o salãodoestudante2014 está chegando via ,neutro
156,"1,18203100568903E+018",✅reformas para facilitar a vida de quem quer emprender e trabalhar agilizando a abertura de empresas simplificando a contratação de funcionários e muito mais✅abertura comercial para ganharmos competitividade em nosso mercado e nos integrarmos a economia mundial,direita
157,"1,18300337861344E+018",felizdiadascriancas,neutro
158,"1,1830215825261E+018", 🤣😂🤣,neutro
159,"1,18307992641047E+018", k,neutro
160,"1,17365313604681E+018", segundo a lei n 13767 sancionada em dezembro de 2018 o empregado poderá deixar de comparecer ao serviço sem prejuíz…,neutro
161,"1,17593012115443E+018", mais um imbecil,neutro
162,"1,18188062518957E+018", hoje vc é livre liberdade para garantir sua própria segurança ou vc é livre de segurança,neutro
163,"1,18271152798141E+018", nobel da paz 2019 ignora favoritos das casas de aposta entre eles o cacique caiapó raoni metuktire e a sueca greta thun…,neutro
164,"1,000400200371E+018", acho que o bruninho quer morrer com esse técnico,neutro
165,"1,18207822220647E+018", a insanidade desse senhor não tem como ser mensurada o cidadão é bruto ignorante e ainda se acha tudo culpa de um gado mais desmiolado que ele,neutro
166,"1,18268982873283E+018",eu vi uma mulher gigante com um sorriso de quem tem fé na vida e na humanidade preta ferreira está livre ❤️ pretalivre 📷 ,neutro
167,"1,17481761155474E+018", setembroamarelonão existem problemas dos quais não possamos falar falar é a melhor solução reconectese com a feli…,neutro
168,"1,12251644263576E+018",newprofilepic inbrendanwetrust comeonleicester,neutro
169,"4,31267738942968E+017", conheça quem faz o lá no nosso blog   via ,neutro
170,"1,183208074536E+018", saudades de quando eu ganhava seguidores toda hora sabadodetremurasdv,neutro
171,"1,1447225605354E+018", show de bola prof apoiado,neutro
172,"1,15422815273613E+018", ou ser demitido tuga,neutro
173,"1,17919994299858E+018", como alguém pode afirmar que o comunismo acabou quando a segunda maior potência do mundo é comunista só por que ela ad…,esquerda
174,"1,18265903913578E+018",o gogle hoje presta homenagem mais do que merecida a maria firmina dos reis primeira romancista negra do país que publicou o romance úrsula em 1859 maria também se dedicou ao ensino e a luta abolicionista e hoje 1 de outubro seria seu 194º aniversário ✊🏾 ,neutro
175,"1,18278157565996E+018", mas com jornalistas deste nível  esquerdistas  rancorosos  etc vai continuar perdendo ,direita
176,"1,18320249267234E+018",botafogo corre contra o tempo para evitar desmanche do elenco na justiça via ,neutro
177,"1,18280480840054E+018", adorei a atitude de vcs parabéns,neutro
178,"1,18263277330514E+018", 🔞 trasladan a un herido durante las protestas en ecuadorfues imágenes  en este video difundido en redes sociales…,neutro
179,"1,18315527120562E+018", 😡 só porque ficou perfeito ok ,neutro
180,"1,18227315287908E+018", concordo novo álbum tá maravilhoso,neutro
181,"1,18320015858829E+018", vontade daquilo que começa com s e termina com o salário,neutro
182,"1,17796956100342E+018",olhe na janela e veja o dia lindo que deus fez pra vocêpasse uma água no pelo e não esqueça que raúl seixas disse tente outra vez 🎵🎶🎵 em indaiatuba sao paulo ,neutro
183,"1,17760668665326E+018", é muito boa que tri vcs curtirem tb 💚,neutro
184,"1,17760400411064E+018", esquerdista acha que menina de 16 anos pode decidir o futuro do planeta mas não acha que menor de 18 anos tenha capacidad…,direita
185,"1,18067808042108E+018", quatro anos passam rápido,neutro
186,"1,18320260998705E+018", sei que falando parece ser muito fácil por isso já inicio o papo assim pq só sabem retrucarmas pra uma empresa entregar o serviço com qualidade é necessário que a mesma tente estar por dentro de como anda o bem estar de seus trabalhadores,neutro
187,"1,18120830130183E+018", o brasil tem mais assassinatos do que todos estes países somados via ,neutro
188,"1,17703916152367E+018", a tv record ganhando dinheiro fácil k,neutro
189,"1,18266228663018E+018", kk,neutro
190,"1,18315536395427E+018", bolsonaro surprende a todos ele esteve no santuário de nossa senhora aparecida para celebrar o dia da padroeira do brasi…,neutro
191,"1,18268656889461E+018", um bom dia publicando esse click pra avisar que mesmo depois de perder nois não para de correr sendo assim to clicando d…,neutro
192,"1,1862850913765E+018",miliciano ,neutro
193,"1,18241498922481E+018",gostou do filme então vai gostar mais ainda do livro que mostra os bastidores nunca noticiados pela imprensa já disponível para prévenda na amazon e em breve em todas as livrarias pela editora recordlancamento nos dias 15 e 16 de novembro no congresso nacional do mbl d ,neutro
194,"1,18315859780874E+018", ja to bem tomei agua,neutro
195,"1,13413920449618E+018", tem um resumão,neutro
196,"1,18231939545817E+018", cristão vive ridicularizando esteriotipando excluindo outras religiões gays e ateus mas se fizer menção ao seu jesus europeu é o fim dos tempos faça me o favor k,esquerda
197,"1,18297977324245E+018", now i like tatas like everyone else but this sick broad takes sickness to another levelwhere tf do these people come f…,neutro
198,"1,18313188479411E+018", com essa pf direcionada tenho minhas dúvidas,neutro
199,"1,18314228956213E+018", corrupto,neutro
200,"1,1870999482293E+018",muito disseram e até pediram apoio na internet afirmando que a cpi lava togas atrapalharia a reforma da previdência previdência aprovada aos que me cobraram vamos agora juntos cobrar destes que assinem e apoiem a cpi doa a quem doer,esquerda
201,"1,18736009524567E+018",a deu em seus 4 anos de colunas da folha lições de economia sem economês lembro quando ela foi dar uma palestra no grupo de estudos do todos entenderam e seu didatismo nunca custou a profundidade ou o espírito crítico parabéns laura,neutro
202,"1,18733816921107E+018",mulher entrando em casa bandidos viram a oportunidade e foram pra cima só não contavam que ela estaria armada fim ,direita
203,"1,16782280714688E+018",av marcelino pires ,neutro
204,"1,18275068146533E+018",ô mariele quero justiça não aceitamos deputado da milícia 🎵estudantes do colégio pedro i deram a letra para os deputados que precisam destilar ódio para sobreviver politicamente os jovens mostram que o futuro é promissor o brasil é melhor que os bolsonaristas 💛 ,esquerda
